Descripcion;Precio_Venta_Final;IdArticulo;Stock
ADORNO PINCHE JUGADORES BOCA CON ESCUDO x6u. ETIQUETADOS;5271,76;10298996;8,00
ADORNO PINCHE JUGADORES RACING CON ESCUDO x6u. ETIQUETADOS;5020,73;10298997;0,00
ADORNO PINCHE JUGADORES INDE PENDIENTE CON ESCUDO x6u. ETIQUETADOS;5020,73;10298998;0,00
ADORNO PINCHE JUGADORES SAN LORENZO CON ESCUDO x6u. ETIQUETADOS;4781,62;10298999;0,00
GORRO BOMBIN / CHAPLIN IMPORTADO x1  MM134-25;6042,81;10299061;4,00
PALO DE AMASAR CON VARILLAS NIVELADORAS x1 715 (FERPA);20797,50;10299078;1,00
SET 6 SORBETES METAL Y CEPILLO x1 202145;5596,90;10299098;0,00
VINCHA SEDA PREMIUN MULTICOLOR ;4300,19;10299118;1,00
INFLADOR PARA GLOBO DOBLE ACCION METALIZADOx1 U23-272/ CL89;2576,57;10299132;0,00
ADORNO HAPPY HALLOWEEN PARA COLGAR NARANJA STASIO x1 HA0003;5667,81;10299319;10,00
MASCARA VENOM IMPORTADA  x1 174;3427,81;10299326;3,00
MASCARA MARSHMELLOW IMPORTADA  x1 173;2636,08;10299327;0,00
ANTEOJO MEMES  x1 164;2527,21;10299335;1,00
BANDERIN HAPPY BIRTHDAY CUADRILLE 3M x1 CL838;1876,27;10299348;7,00
SET OREJA CONEJA Y COLA /MOÑO PELUCHE  x1 270;3100,78;10299350;1,00
GLOBO DE CANCHA (NUDO) SURTIDO FLUO 1.20x0.20 mtr x20;17994,64;10299357;6,00
GLOBO GLOBOX LISO 12" CORAL x50 71637;9842,76;10299364;9,36
GLOBO GLOBOX LISO 12" MAIZ x50 71644;10070,79;10299365;2,38
PIÑATA CARTON NEGRA DIVERCOTYx1;0,00;10299379;0,00
BANDERIN FELIZ CUMPLE DINO PARTY 01-109 x1u.RONDINELLA;3440,59;10299421;0,00
GUIRNALDA MARGARITAS BLANCAS 01-139 x1u.RONDINELLA;1669,85;10299425;0,00
GUIRNALDA FLOR MARGARITA 02-242 Ix1u.RONDINELLA;2107,38;10299427;16,00
PASTILLAS ESTRELLITAS BLUPER x400gr 30287;6797,97;10299449;0,00
PASTILLAS CORAZONES BLUPER x400gr 30288;6797,97;10299450;-0,25
PASTILLAS MEGA TUTTI FRUTTI BLUPER x336gr 30281;6190,75;10299451;0,00
VOLCAN CHISPAS FRIO CAJA x4und IN220 M;12006,99;10299457;0,00
PORRON METALIZADO DORADO;4415,24;10299458;6,00
GORRO ALMIRANTE CON BRILLO VARIOS COLORES  x1 RM;11979,00;10299467;0,00
GORRO ALMIRANTE TORNASOL CON STRASS DORADO/PLATA x1 RM;14157,00;10299469;0,00
GORRO ALMIRANTE PLATA GEMAS Y STRASS VARIOS MODELOS x1 RM;11979,00;10299470;0,00
CAÑON REVELACION DE GENERO CELESTE x1 4200C;4445,39;10299481;3,00
MOLDE SILICONA HUELLITA GRANDE x1 BM2381;2536,07;10299560;2,00
TIARA CON STRASS PLATEADA VARIOS MODELOS x1 PA480;4146,91;10299595;0,00
VINCHA OREJA CONEJA LENTEJUELA Y PELUCHE x1 FJ2630;2111,91;10299609;3,00
PINCHOS TENEDOR DE MADERA C.B.X (9 cm) x100 und.;2676,26;10299613;12,00
SERVILLETA HALLOWEEN FONDO NEGRO x20u. C.O;2596,83;10299652;5,00
DISFRAZ ADULTO/ADOLESCENTE CAVERNICOLA MUJER T2;35078,05;10299659;2,00
ADORNO COLGANTE HAPPY HALLOWEEN VIOLETA STASIO x1 HA0003;5667,81;10299666;10,00
STICKERS EN PLANCHA SONIC (plancha 2 x 12) C.O;1549,91;10299679;16,00
BANDERIN SONIC  x1 C.O;3359,78;10299680;1,00
MANTEL SONIC (1.20x1.80) x1 C.O;8664,08;10299684;3,00
PIÑATA CARTON SONIC x1 C.O;5645,57;10299685;1,00
SERVILLETA SONIC x20 C.O;3196,08;10299687;4,00
VASO DE POLIPAPEL SONIC x8 C.O;3372,74;10299688;6,00
ADORNO SET PINCHE FELIZ FONDO DEL MAR x1 0789-5;3510,94;10299694;0,00
ADORNO PINCHE FELIZ CUMPLEAÑOS Y MARIPOSAS CON BRILLO x1 0587-10;2321,75;10299697;0,00
ADORNO PINCHE ARCO IRIS POMPON MULTICOLOR PASTEL x1 0806;4167,12;10299703;0,00
GORRA GLAMOUR CON  STRASS VARIOS MODELOS x1;9147,60;10299711;1,00
BLISTER STRASS PARA CUERPO x1 VARIOS MODELOS;2720,98;10299759;7,00
ADORNO PINCHE  ARCO IRIS CON ESTRELLA Y NUBES x1 0712-10;3001,28;10299760;0,00
ESPATULA DE SILICONA GRIS MANGO DE MADERA 32 CM x1 202807;4496,75;10299797;0,00
VINCHA FELIZ CUMPLEAÑOS DELUXE (VARIOS COLORES) x1;3620,93;10299849;0,00
SET DE GLOBOS HALLOWEEN COCO 5 PIEZAS x1 WSJ-03;5440,95;10299858;2,00
CAJA MULTIUSO CON VISOR RECTANGULAR 25x16x11cm;1527,68;10299879;40,00
PIROTIN CUPCAKE Nº10 (M-PACK) DINOSAURIOS;735,39;10299881;-0,97
GLOBO METALIZADO CORAZON 5" ROJO xU;151,03;10299912;1,00
GLOBO METALIZADO CORAZON 5" FUCSIA;151,03;10299913;64,00
INFLABLE LA MUERTE;88666,38;10300044;0,00
INFLABLE UNICORNIO;92172,96;10300045;1,00
INFLABLE DINOSAURIO;108954,45;10300046;1,00
INFLABLE BAÑERA;96921,00;10300048;1,00
PECHO PELUDO MACHO ALFA;3005,64;10300056;7,00
SET CONEJITA - OREJAS + CUELLO + PULSERAS;12136,30;10300057;7,00
LAMPARA DE GENIO 22,5x12cm;6092,35;10300060;34,00
DOLAR FANTASIA PARA LLENAR LA BILLETERA;3571,92;10300062;18,00
CRUZ CRISTIANA 24x13,5cm;3562,24;10300068;1,00
OREJAS ELFICAS;5596,25;10300070;81,00
SET STRIPPER - CUELLO + PULSERAS;6659,54;10300071;29,00
ESPOSAS SEXY;3657,23;10300075;12,00
ALAS DE ANGELITO COLOR BLANCO;8360,80;10300083;-6,00
ALAS DE ANGELITO COLOR NEGRO;8360,80;10300084;13,00
BOQUILLA CHARLESTON;2541,00;10300086;-7,00
SUPER HUESO JUMBO;3920,40;10300089;4,00
COLLAR DINERO *$* 24K RAPERO;5021,50;10300092;-2,00
ALAS DE ANGELITO COLOR ROJO;8134,83;10300115;0,00
VINCHA HALO AUREOLA DE ANGEL PLUMAS NEGRAS;3185,33;10300116;10,00
SABLE CORVO;9038,70;10300120;0,00
CORONA PRÍNCIPE PLATA;2560,36;10300122;0,00
CORONA EMPERADOR LAURELES DORADOS;4477,00;10300123;9,00
VINCHA TIGRE A RAYAS;2308,68;10300128;1,00
VINCHA MEDUSA;12959,10;10300134;21,00
VINCHA EGIPCIA GOLD CLEOPATRA;9474,30;10300135;3,00
VELO DE NOVIA BLANCO;4341,48;10300145;32,00
VELO DE VIUDA NEGRO;4341,48;10300146;31,00
MASCARA CARETA HIP HOP ROJA;3902,25;10300147;12,00
MASCARA CARETA HIP HOP VIOLETA;3902,25;10300148;7,00
MASCARA CARETA HIP HOP AMARILLA;3902,25;10300150;5,00
MASCARA CARETA HIP HOP AZUL;3902,25;10300151;13,00
MASCARA CARETA HIP HOP VERDE;3902,25;10300152;1,00
MASCARA CARETA HIP HOP NARANJA;3902,25;10300153;5,00
MASCARA CARETA HIP HOP MAGENTA;3902,25;10300154;5,00
MASCARA CARETA CALABAZA PUMPKIN;3809,32;10300156;17,00
MASCARA CARETA PURGA;6352,50;10300157;-1,00
MASCARA CARETA JASON;3430,35;10300158;-5,00
MASCARA CARETA UK SKULL;3509,00;10300165;5,00
COLLAR HAWAII HULA FLORES AZUL;1730,30;10300170;-1,00
COLLAR HAWAII HULA FLORES VERDE;1730,30;10300171;0,00
COLLAR HAWAII HULA FLORES ROJO;1730,30;10300172;0,00
COLLAR HAWAII HULA FLORES NARANJA;1730,30;10300173;-5,00
COLLAR HAWAII HULA FLORES ROSA;1730,30;10300174;0,00
COLLAR HAWAII HULA FLORES MULTICOLOR;1730,30;10300175;0,00
COLLAR HAWAII HULA FLORES AMARILLO;1730,30;10300177;-11,00
POLLERA HULA HAWAII ROJA;4786,76;10300178;22,00
POLLERA HULA HAWAII VIOLETA;4786,76;10300179;-15,00
POLLERA HULA HAWAII NATURAL;4786,76;10300180;14,00
POLLERA HULA HAWAII AMARILLA;4786,76;10300181;12,00
POLLERA HULA HAWAII AZUL;4786,76;10300182;0,00
POLLERA HULA HAWAII VERDE;4786,76;10300183;9,00
POLLERA HULA HAWAII MULTICOLOR;4786,76;10300184;8,00
POLLERA HULA HAWAII NARANJA;4786,76;10300185;36,00
POLLERA HULA HAWAII ROSA;4786,76;10300186;28,00
VINCHA FLORES MULTICOLOR AC518;2276,01;10300188;161,00
TUTU NEON FLUO ROSA 45cm;11011,00;10300191;0,00
TUTU NEON FLUO AMARILLO 45cm;11011,00;10300193;0,00
TUTU NEON FLUO NARANJA 45cm;11011,00;10300194;0,00
TUTU FLUO NEON MULTICOLOR 45cm;13552,00;10300195;-6,00
TUTU NEGRO 30cm ADULTOS;11011,00;10300196;0,00
TUTU ROJO 30cm ADULTOS;11011,00;10300197;1,00
TUTU BLANCO 30cm ADULTOS;11011,00;10300198;0,00
TIRADORES NEON FLUO ROSA;3606,77;10300204;0,00
TIRADORES NEON FLUO VERDE;3606,77;10300205;31,00
TIRADORES NEON FLUO AMARILLO;3606,77;10300206;31,00
TIRADORES NEON FLUO NARANJA;3606,77;10300207;8,00
TIRADORES NEON FLUO MULTICOLOR;4608,65;10300208;-2,00
TIRADORES NEGROS;3606,77;10300209;5,00
TIRADORES BLANCOS;3606,77;10300210;23,00
MEDIAS BUCANERAS NEON FLUO ROSA 68cm;6345,24;10300211;11,00
MEDIAS BUCANERAS NEON FLUO VERDE 68cm;6345,24;10300212;30,00
MEDIAS BUCANERAS NEON FLUO NARANJA 68cm;6345,24;10300214;17,00
MEDIAS BUCANERAS NEON FLUO ARCO IRIS 68cm;7569,76;10300215;18,00
MEDIAS BUCANERAS NEGRAS 68cm;6233,92;10300216;12,00
MEDIAS BUCANERAS BLANCAS 68cm;6233,92;10300217;11,00
GUANTE DE RED RETRO AMARILLO;1820,81;10300218;71,00
GUANTE DE RED RETRO AZUL;1820,81;10300219;2,00
GUANTE DE RED RETRO BLANCO;1820,81;10300220;0,00
GUANTE DE RED RETRO NARANJA;1820,81;10300221;33,00
GUANTE DE RED RETRO NEGRO;1820,81;10300222;30,00
GUANTE DE RED RETRO ROJO;1820,81;10300223;8,00
GUANTE DE RED RETRO ROSA;1820,81;10300224;51,00
GUANTE DE RED RETRO VIOLETA;1820,81;10300226;30,00
GUANTES DE DAMA/ CHARLESTON BLANCOS 45cm (par);4353,28;10300228;1,00
GUANTES DE DAMA/ CHARLESTON NEGROS 55cm (par);5336,10;10300229;0,00
GUANTES DE DAMA/ CHARLESTON BLANCOS 55cm (par);5202,70;10300230;0,00
CAPA DISFRAZ DRACULA CHICA 80cm;12947,00;10300232;0,00
CAPA DISFRAZ DRACULA GRANDE 130cm;15473,48;10300233;0,00
CAPA DISFRAZ REVERSIBLE NEGRO/ROJO 80cm;17702,30;10300234;0,00
CAPA DISFRAZ REVERSIBLE NEGRO/ROJO 130cm;22651,20;10300235;0,00
CAPA DISFRAZ CAPERUCITA CORTA ROJA BRILLANTE 80cm;15221,80;10300236;-1,00
CAPA DISFRAZ REVERSIBLE NEGRO/ROJO CON CAPUCHA 80cm;18392,00;10300237;-1,00
CAPA DISFRAZ REVERSIBLE NEGRO/ROJO CON CAPUCHA 130cm;21562,20;10300238;0,00
CAPA DISFRAZ DORADA 130cm;23086,80;10300239;0,00
CAPA DISFRAZ NEGRA CON CAPUCHA 80cm;13431,00;10300240;0,00
CAPA DISFRAZ NEGRA CON CAPUCHA 130cm;15978,05;10300241;0,00
DECORACION PARA TORTAS UNICORNIOS;781,66;10300248;5,00
DECORACION PARA TORTAS FOOTBALL;2069,10;10300249;1,00
DECORACION PARA TORTAS CARRERAS;2929,94;10300251;0,00
DECORACION PARA TORTAS PIRATAS;2866,25;10300252;5,00
DECORACION PARA TORTAS FOOTBALL ROJO Y BLANCO;3908,30;10300253;0,00
DECORACION PARA TORTAS FOOTBALL AZUL Y AMARILLO;3908,30;10300254;0,00
DECORACION PARA TORTAS SIRENITAS;1954,15;10300255;1,00
ANTIFAZ MONSTERS surtido x 6 unidades;3993,00;10300258;11,00
ANTIFAZ CALACA x 6 unidades;4235,00;10300263;14,00
ANTIFAZ LEOPARDO;992,20;10300272;0,00
ANTIFAZ TIGRE;992,20;10300273;7,00
ANTIFAZ CEBRA;943,80;10300274;9,00
ANTIFAZ DE ENCAJE CORONA *NEGRO*;3450,92;10300284;0,00
ANTIFAZ DE ENCAJE GATITA *NEGRO*;3450,92;10300285;7,00
ANTIFAZ DE ENCAJE VENECIA *NEGRO*;3563,45;10300286;0,00
ANTIFAZ DE ENCAJE CORONA *BLANCO*;1536,22;10300289;0,00
ANTIFAZ DE ENCAJE GATITA *BLANCO*;2395,80;10300290;18,00
ANTIFAZ DE ENCAJE CORONA *ROJO*;1391,50;10300294;18,00
ANTIFAZ DE ENCAJE GATITA *ROJO*;1210,00;10300295;21,00
ANTIFAZ DE ENCAJE VENECIA *ROJO*;1815,00;10300296;15,00
ANTIFAZ DE ENCAJE MARIPOSA NOCTURNA *ROJO*;1436,88;10300297;5,00
BARBA BLANCA;3388,00;10300299;-1,00
BANNER FELIZ CUMPLEAÑOS DORADO GLITTER 160 Cm;3807,14;10300304;66,00
BANNER FELIZ CUMPLEAÑOS NENA 180x12x15 Cm;4985,20;10300306;0,00
BANNER FELIZ CUMPLEANOS VARÓN 180x12x15 Cm;4985,20;10300308;39,00
GUIRNALDA CALADA TIPO MEXICANA ESTRELLAS;3283,94;10300323;0,00
GUIRNALDA BANDERIN CALADO TIPO MEXICANO BOTELLAS;4029,30;10300324;87,00
GUIRNALDA CALADA TIPO MEXICANA FLORES;3005,64;10300325;0,00
BARBA NEGRA;3388,00;10300329;17,00
BANNER FELIZ CUMPLEAÑOS PLATEADO GLITTER 160 Cm;4118,84;10300330;-21,00
BENGALA HUMO COLOR AMARILLO;3100,93;10300332;19,00
BENGALA HUMO COLOR AZUL;3100,93;10300333;-1,00
BENGALA HUMO COLOR NARANJA;3100,93;10300336;9,00
BENGALA HUMO COLOR ROSA;3100,93;10300338;36,00
BENGALA HUMO COLOR VIOLETA;3100,93;10300340;7,00
CORNETA PLASTICA 29 cm;2323,20;10300349;92,00
BOLSA PAPEL CONFETTI ESTRELLAS METALIZADAS;4341,48;10300369;3,00
BOLSA CONFETTI PETALOS DE ROSA DE TELA ROJOS;3218,60;10300370;0,00
BOLSA PAPEL CONFETTI RECTANGULAR MULTICOLOR;400,75;10300372;-21,00
CONFETTI CIRCULOS MALVAVISCOS;3146,00;10300384;-1,00
CONFETTI CIRCULOS FRESAS;3146,00;10300385;0,00
KIT BANDEJA + CELOFAN + CINTA BOMBONES;3484,80;10300415;69,00
KIT BANDEJA + CELOFAN + CINTA DORADA;3484,80;10300416;6,00
MANTEL PLASTICO PIRATA 180cm x 130cm;2215,27;10300421;6,00
MANTEL PLASTICO MONSTER TRUCK 180cm x 130cm;2003,76;10300422;0,00
MANTEL PLASTICO FOOTBALL 180cm x 130cm;4786,76;10300424;11,00
MANTEL PLASTICO PANDA 180cm x 130cm;886,11;10300433;14,00
PLATO POLIPAPEL 17cm PERLADO MARINERO CELESTE x 6 un;2226,40;10300438;1,00
PLATO DE POLIPAPEL 17cm CON FORMA PIRATA x 6 un;2716,21;10300440;2,00
PLATO DE POLIPAPEL 17cm MULTICOLOR x 6 unidades;2541,00;10300444;9,00
PLATO DE POLIPAPEL 17cm UNICORNIO SWEET x 6 un;2337,72;10300446;5,00
PLATO DE POLIPAPEL 17cm SIRENITA x 6 unidades;489,81;10300447;12,00
PLATO DE POLIPAPEL 17cm FELIZ CUMPLE x 6 unidades;2413,95;10300450;24,00
PLATO DE POLIPAPEL 17cm CON FORMA VERANO x 6 un;6679,20;10300453;0,00
PLATO DE POLIPAPEL 17cm CON FORMA SANDIA x 6 unidades;2838,66;10300458;0,00
PLATO DE POLIPAPEL 17cm CON FORMA TIBURON x 6 u;3702,60;10300461;3,00
PLATO DE POLIPAPEL 17cm CON FORMA ARCOIRIS x 6 unidades;3569,50;10300463;42,00
PLATO DE POLIPAPEL 17cm FELIZ CUMPLEAÑOS NEGRO CON BURBUJAS x 6 un;2507,12;10300475;38,00
PLATO DE POLIPAPEL 17cm COLOR PASTEL MULTICOLOR x 6 un;2337,72;10300477;-2,00
PLATO DE POLIPAPEL 17cm ROSA LUNARES DORADOS x 6 un;2504,70;10300479;-3,00
PLATO DE POLIPAPEL 17cm CELESTE LUNARES PLATEADOS x 6 un;2504,70;10300480;1,00
PLATO DE POLIPAPEL 17cm LUNARES DORADOS x 6 un;2504,70;10300481;0,00
PLATO DE POLIPAPEL 17cm BORDE DORADO x 6 unidades;2783,00;10300482;0,00
PLATO DE POLIPAPEL 17cm BORDE PLATEADO x 6 un;2783,00;10300483;0,00
PLATO GRANDE 22,5 cm POLIPAPEL UNICORNIO IRIDISCENTE x 6 unidades;3506,58;10300487;12,00
SERVILLETA DE PAPEL UNICORNIO IRIDISCENTE x 12 un;2905,45;10300490;0,00
SERVILLETA DE PAPEL PERLADO MARINERO CELESTE x 12 un;3105,83;10300492;36,00
SERVILLETA DE PAPEL PIRATAS x 20 unidades;2401,51;10300494;25,00
SERVILLETA DE PAPEL ELEFANTE ROSA x 20 unidades;1368,51;10300495;23,00
SERVILLETA DE PAPEL ELEFANTE CELESTE x 20 unidades;1368,51;10300496;56,00
SERVILLETA DE PAPEL MONSTER TRUCK x 20 unidades;2329,37;10300497;9,00
SERVILLETA DE PAPEL MULTICOLOR x 20 unidades;3450,92;10300498;2,00
SERVILLETA DE PAPEL FOOTBALL x 20 unidades;3105,83;10300499;0,00
SERVILLETA DE PAPEL CON FORMA DONAS x 20 un;1452,73;10300502;1,00
SERVILLETA DE PAPEL FELIZ CUMPLE x 20 unidades;3469,68;10300504;4,00
SERVILLETA DE PAPEL ENCAJE x 20 unidades;3339,60;10300512;-1,00
SERVILLETA DE PAPEL  SIRENA DE MAR x 12 un;1903,57;10300513;0,00
SERVILLETA DE PAPEL  TIBURON x 12 un;2159,85;10300514;5,00
SERVILLETA DE PAPEL ARCO IRIS x 20 unidades;3195,61;10300516;0,00
SERVILLETA DE PAPEL ZORRO x 20 unidades;3005,64;10300518;14,00
SERVILLETA DE PAPEL COLOR PASTEL SURTIDO x 20 unidades;3807,14;10300526;0,00
SERVILLETA DE PAPEL IRIDISCENTE x 12 un;2838,66;10300527;0,00
SERVILLETA DE PAPEL LUNARES DORADOS x 12 unidades;4007,52;10300528;0,00
SERVILLETA DE PAPEL BORDE DORADO x 12 unidades;4452,80;10300529;0,00
SERVILLETA DE PAPEL BORDE PLATEADO x 12 unidades;4452,80;10300530;6,00
SERVILLETA DE PAPEL FLUO x 20 unidades;3920,40;10300531;0,00
VASO DE POLIPAPEL MULTICOLOR x 6 unidades;2541,00;10300591;4,00
VASO DE POLIPAPEL FOOTBALL x 6 unidades;2413,95;10300592;0,00
VASO DE POLIPAPEL SIRENITA x 6 unidades;434,15;10300594;11,00
VASO DE POLIPAPEL FELIZ CUMPLE x 6 unidades;2541,00;10300596;8,00
VASO DE POLIPAPEL PLATEADO x 6 unidades;2613,60;10300614;0,00
DISPLAY PALILLOS EN BOLSITA DE *CELOFAN* x 1000 un.;5445,00;10300636;0,00
GLOBO BURBUJA 24";1000,07;10300638;29,00
GLITTER PACK x 6 ESTRELLITAS ROSA Y CELESTE;2904,00;10300814;20,00
GLITTER PACK x 6 CORAZONES;2922,15;10300815;11,00
GLITTER PACK x 6 HOJITAS IRIDISCENTES;3630,00;10300816;14,00
GORRO SANTA;1905,75;10300970;0,00
GORRO SANTA PREMIUM;6050,00;10300971;-1,00
GORRO FUNYI LENTEJUELAS MULTICOLOR;4682,70;10300975;16,00
GORRO FUNYI ARCOIRIS;6092,35;10300977;0,00
GORRO GALERA BAJA;9196,00;10300981;9,00
GORRO BRUJA TRANSPARENTE;3357,75;10300982;1,00
GORRO BRUJA CLASICO NEGRO LISO;3868,37;10300983;121,00
GORRO BRUJA CON FANTASMAS;7260,00;10300986;2,00
GORRO BRUJA NEGRO TELARANA;3454,21;10300988;-1,00
GORRO BRUJA ARANA GIGANTE CON TRANSPARENCIA;5282,91;10300990;9,00
GORRO BRUJA ARANA GIGANTE NEGRO;3321,36;10300991;0,00
GORRO BRUJA FLUO CON MURCIELAGOS;4368,56;10300995;46,00
GORRO BRUJA ROJO NEGRO BORDE FLECO TELARANA;4516,22;10300996;5,00
GORRO BRUJA CON LAZO;9147,60;10300999;6,00
GORRO BRUJA CON GLITTER;3957,64;10301001;0,00
GORRO BRUJA CON HEBILLA STRASS;11906,40;10301002;0,00
GORRO BRUJA BICOLOR CON TELA NARANJA DISEÑO NEGRO;5299,80;10301003;16,00
GORRO BRUJA CALAVERA TERROR CON TELARAÑA;7441,50;10301004;1,00
GORRO BRUJA CALAVERA Y FLORES;7924,29;10301006;6,00
GORRO BRUJA CON PLUMA Y FLOR;4608,65;10301007;-1,00
GORRO BRUJA TELA ESPECIAL SIMIL CUERO;17472,40;10301008;5,00
GORRO BRUJA PREMIUM;30274,20;10301009;13,00
GORRO SOMBRERERO;26494,16;10301010;1,00
GALERA SAN PATRICIO;16250,30;10301011;0,00
GORRO PIRATA ADULTO BORDE DORADO - PLATA;5566,00;10301014;-1,00
GORRO PIRATA BANDANA CON CALAVERA DORADA;3121,80;10301016;-1,00
GORRO PIRATA SIMIL CUERO;13612,50;10301017;14,00
GORRO PAYASO ALTO RAYADO;9619,50;10301021;1,00
GORRO AVIADOR MARRON;7413,91;10301025;1,00
GORRO MARINERO;8058,60;10301026;2,00
GORRO CAPITÁN;7241,85;10301027;0,00
GORRO POLICÍA;10672,20;10301028;7,00
GORRO CHOFER;12199,83;10301032;9,00
CASCO ESPARTANO DORADO;18851,80;10301035;4,00
CASCO SOLDADO ROMANO CRESTA PLUMAS ROJAS;22070,40;10301036;-1,00
GORRO OKTOBER FEST BAVARO ALEMAN;16698,00;10301038;6,00
GORRO MOSQUETERO NEGRO PLUMA AMARILLA;13552,00;10301039;1,00
GORRO REY ROJO Y DORADO CON GEMA;11180,40;10301043;9,00
GORRO BOMBÍN GLITTER DORADO;1560,90;10301058;89,00
GORRO BOMBÍN GLITTER FLUO;2170,74;10301059;0,00
GORRO BOMBÍN GLITTER PLATA;1335,84;10301061;27,00
GORRO GALERA GLITTER DORADA;1149,50;10301062;37,00
GORRO GALERA GLITTER COLORES SURTIDOS;566,28;10301063;32,00
GORRO EMOJI POPÓ;2671,68;10301066;0,00
GORRO PORTA BEBIDAS;21029,80;10301067;3,00
GORRO FLAMENCO;11561,55;10301068;2,00
CASCO CONSTRUCTOR;9147,60;10301069;10,00
GORRO HECHICERO;9310,95;10301072;0,00
GORRO BRUJA MALEFICA;18513,00;10301077;1,00
CASCO INFANTERIA;14886,03;10301084;2,00
CASCO US ARMY;7163,20;10301086;9,00
CASCO MILITAR CAMUFLADO;10520,95;10301087;11,00
CASCO DE CARRERA;11521,62;10301088;7,00
CASCO GALACTICO;44834,13;10301089;0,00
CASCO GLADIADOR;22990,00;10301093;0,00
CASCO MEDIEVAL;18966,75;10301094;5,00
CASCO BARBARO;16475,36;10301095;-3,00
CASCO NORDICO;8724,71;10301096;9,00
CASCO FOOTBALL AMERICANO;33740,85;10301097;2,00
CASCO MINERO LUMINOSO LED;13549,58;10301100;0,00
GORRO BANDANA ARGENTINA;3932,50;10301103;0,00
BOMBIN ARGENTINA;1294,70;10301105;286,00
MASCARA SPANDEX CONEJITA;8393,53;10301109;3,00
MASCARA SPANDEX DIABLITA;8712,00;10301110;12,00
BONETE NEON FLUO 23cm colores surtidos;1224,52;10301118;139,00
PARCHE PIRATA;1013,38;10301123;36,00
ESPADA MEDIEVAL;13612,50;10301126;0,00
TONFA POLICIA / BASTON POLICIA;4682,70;10301128;22,00
CINTURON DE BALAS;21235,50;10301129;0,00
ESCUDO ESPARTANO;16637,50;10301131;0,00
ESCUDO MEDIEVAL;19458,74;10301132;-1,00
ESPADA PIRATA - 68 cm;9801,00;10301134;0,00
GUIRNALDA DINOSAURIOS 360x18x17,5 Cm;2359,50;10301167;12,00
GUIRNALDA BIBERÓN NENA 360x20x11,4 Cm;2541,00;10301168;6,00
GUIRNALDA BIBERÓN VARÓN 360x20x11,4 Cm;2541,00;10301169;17,00
GUIRNALDA CHUPETE NENA 360x18x16 Cm;1742,40;10301170;2,00
GUIRNALDA CHUPETE VARÓN 360x18x16 Cm;1742,40;10301171;0,00
GUIRNALDA TIPO MEXICANA NENA 200X20X13,5 Cm;1161,60;10301176;3,00
GUIRNALDA TIPO MEXICANA VARON 200X20X13,5 Cm;1161,60;10301177;9,00
GUIRNALDA BOA ROSA CON ESTRELLAS 180 cm;3158,10;10301180;4,00
GUIRNALDA BORLAS DORADAS 3 mts;3773,39;10301190;39,00
GUIRNALDA BORLAS NARANJA Y NEGRO 300 Cm;622,07;10301207;0,00
GUIRNALDA CORONAS NENA 360x18x13,3 Cm;1331,00;10301224;55,00
GUIRNALDA FORMAS MULTICOLOR N 1 360x17x17 Cm;4573,80;10301236;10,00
GUIRNALDA PANAL MULTICOLOR 200x8x6 Cm  Bolsa x 4 unidades;6567,88;10301237;73,00
GUIRNALDA BANDERINES MULTICOLOR 360x22x12,5 Cm;3673,56;10301238;13,00
GUIRNALDA MOÑOS MULTICOLOR 360x12x12 Cm;2604,89;10301239;-9,00
GUIRNALDA FLOR MULTICOLOR N 1 360x17x17 Cm;2708,59;10301240;1,00
GUIRNALDA FLOR MULTICOLOR N 2 360x18x18 Cm;2315,46;10301243;30,00
GUIRNALDA FORMAS MULTICOLOR N 3 360x16x16 Cm;2897,66;10301244;15,00
GUIRNALDA ANANA MULTICOLOR 360x20x11,5 Cm;1914,70;10301245;8,00
GUIRNALDA CUPCAKES MULTICOLOR 360x18x15,1 Cm;2613,60;10301246;24,00
GUIRNALDA CORAZON MULTICOLOR 360x18x17 Cm;4573,80;10301248;-12,00
GUIRNALDA BORLAS ARCOIRIS (DIY) 300 Cm;6011,28;10301253;1,00
COLGANTE SCREAM BLANCO 35x42cm;2855,36;10301281;-2,00
COLGANTE CALABAZA NEGRO 36x42cm;2855,36;10301282;1,00
COLGANTE PAYASO NEGRO / ROJO 36x43cm;2248,79;10301283;39,00
COLGANTE BRUJA NEGRO VIOLETA 37x42cm;3781,25;10301284;-5,00
CALAVERA DECO 13x12x16cm;9438,00;10301287;0,00
ARANA MEDIANA ROJA Y NEGRA 43x9x4cm;4138,20;10301292;6,00
COLGANTE BRUJA CON ESCOBA 45x35cm;3743,74;10301298;0,00
ESQUELETO DE ANGEL CHICO 43x24cm;13369,83;10301299;3,00
COLGANTE ESQUELETO PIRATA 93cm;33759,00;10301301;8,00
GUIRNALDA CORONA DE ESQUELETO 37x37cm;27830,00;10301309;4,00
COLGANTE SANTA MUERTE ROSA CON FLORES 80cm;12705,00;10301310;1,00
COLGANTE ARANA CALAVERA CON GALERA 14x26x15cm;5684,58;10301317;0,00
ESCOBA VOLADORA DE BRUJA 116cm (este modelo no vuela, pero barre);16698,00;10301318;0,00
TELARAÑA GIGANTE NEGRA 2 Mts;5263,50;10301320;0,00
MOMIA DEL DESIERTO MOVIMIENTO, LUMINOSO LED, CON SONIDO 113x30cm;74807,04;10301332;0,00
GUADAÑA 100x33,5cm;7586,70;10301336;13,00
HACHA LARGA HOJA SIMPLE 113x15cm;3239,78;10301337;5,00
DIENTES DE TERROR;2202,20;10301338;7,00
VINCHA HUESO 40cm;5118,30;10301346;1,00
COLLAR CHOKER CAVERNICOLA;2586,38;10301351;3,00
VINCHA CAVERNICOLA / VUDU;2722,50;10301352;1,00
MASCARA CARETA CALAVERA INFERNAL CON CAPUCHA;5505,50;10301356;8,00
MASCARA CARETA DIABLO DORADO CON CAPUCHA;10164,00;10301357;4,00
PULSERA BRAZALETE CALAVERA VUDU;3242,80;10301358;0,00
COLLAR CON ESQUELETOS VUDU;1694,00;10301359;17,00
PULSERA BRAZALETE PIRATA CON ANILLO Y RUBIES;3388,00;10301360;9,00
DEDOS GARRA FREDDY;15730,00;10301362;13,00
BANDANA CEREBRO ZOMBIE;9583,20;10301370;48,00
GUANTES ESQUELETO;5544,83;10301371;18,00
MASCARA CARETA EL GRITO;2450,25;10301375;-1,00
MASCARA CARETA CRANEO CON CAPUCHA;5455,29;10301376;6,00
ALAMBRES DE PUAS;5445,00;10301377;14,00
MANO CORTADA SANGRIENTA;11495,00;10301378;6,00
TELA SANGRIENTA;10909,36;10301380;9,00
HELITANK CHICO - TANQUE DE HELIO 0,20 M3 (30 Globos de 9 pulg. aprox);78408,00;10301385;0,00
ESTRELLITA ESPECIAL - Sobre x 5;479,16;10301393;-110,00
INFLADOR DE GLOBOS TRICOLOR DOBLE ACCION PREMIUM;5227,20;10301395;0,00
LENTE PLASTICO ESTRELLA;931,70;10301401;13,00
LENTE PLASTICO CORAZON;1494,35;10301402;6,00
LENTE PLASTICO REDONDO RAYAS le06;1464,10;10301406;16,00
LENTE PLASTICO ESTRELLA RAYAS;1452,00;10301407;32,00
LENTES AVIADOR;3822,39;10301409;-24,00
LENTES HIPPIE;3234,33;10301410;24,00
LENTES WAY *BLANCOS*;2172,56;10301412;1,00
LENTES PIXEL TDFW;2424,11;10301414;0,00
MASCARA DE LATEX CABALLO;56995,84;10301432;4,00
MASCARA DE LATEX RASTAFARI LEON DE JUDA;28967,40;10301455;1,00
MASCARA DE LATEX PINCHES CLAVOS;47044,80;10301469;2,00
MASCARA DE LATEX CHUCKY;64251,00;10301470;1,00
MASCARA DE LATEX HIERBA - CANNABIS;4598,00;10301471;10,00
MASCARA DE LATEX CAMINANTE DE HIELO;23293,71;10301476;2,00
MASCARA DE LATEX DEMONIO VIKINGO;29040,00;10301481;2,00
MASCARA DE LATEX ESPANTAPAJAROS C/ SOMBRERO;30946,96;10301485;2,00
INMORTAL;17811,20;10301490;6,00
ANIMOV DRAGON;172788,00;10301504;1,00
MASCARA DE LATEX ANIMOV RAPTOR;119790,00;10301511;1,00
MASCARA DE LATEX JOCKER;25359,53;10301518;0,00
MÁSCARA DE LÁTEX PAYASO MALO;34052,79;10301519;2,00
MASCARA DE LATEX PAYASO ESO IT;60984,00;10301520;4,00
MASCARA DE LATEX MUJER GATO;21235,50;10301526;6,00
MASCARA DE LATEX FREDDY;20570,00;10301530;15,00
MASCARA DE LATEX MICHAEL MYERS;34898,82;10301531;0,00
MASCARA DE LATEX LINDA EXORCISTA;34485,00;10301532;2,00
MASCARA DE LATEX SENOR OSCURO;11616,00;10301533;2,00
CICATRIZ DE LATEX MORDISCO VAMPIRO;2689,23;10301535;3,00
LATEX FX CLAVO INFECTADO;1609,30;10301536;6,00
LATEX FX CICATRIZ Y TORNILLO;2896,74;10301539;2,00
LANZAPAPELES CAÑON 30 CM MULTICOLOR;3430,35;10301552;0,00
LANZAPAPELES 40 CM DOLARES;4087,83;10301554;3,00
LANZAPAPELES 40 CM DORADO;3811,50;10301555;14,00
LANZAPAPELES CAÑON 40 CM MULTICOLOR;3811,50;10301557;5,00
LANZAPAPELES CAÑON 40 CM PLATEADO;3811,50;10301558;5,00
LANZAPAPELES CAÑON 40 CM PETALOS ROSAS;4138,20;10301559;16,00
LANZAPAPELES CAÑON 40 CM SERPENTINAS;3673,56;10301560;-1,00
VINCHA PELUCHE RENO;4719,00;10301573;0,00
VINCHA DOBLE SANTA;3593,70;10301574;0,00
CORONA COLOR ROJO 38 CM;10381,80;10301583;0,00
CORONA COLOR DORADA 38 CM;10527,00;10301584;5,00
CORONA COLOR PLATA 38 CM;10345,50;10301585;8,00
CORONA COLOR VERDE 38 CM;10508,85;10301586;2,00
DECO COPO DE NIEVE METALIZADO 32CM;4985,94;10301589;3,00
PALITO BROCHETTE 15Cm x 100 unidades bolsa AMARILLA;1057,54;10301593;18,00
PALITO BROCHETTE 20Cm x 100 unidades bolsa VERDE;1399,06;10301595;25,00
PALITO BROCHETTE 25Cm x 100 unidades bolsa AZUL;1724,25;10301597;25,00
PALITO BROCHETTE 30Cm x 100 unidades bolsa ROJA;1948,10;10301599;40,00
PINCHE CUPCAKE COPETIN PRINCESA x 20 unidades;2350,43;10301607;29,00
PINCHE CUPCAKE COPETIN UNICORNIO SWEET x 20 unidades;2337,72;10301611;-4,00
PINCHE CUPCAKE COPETIN SIRENITA x 20 unidades;1324,22;10301612;8,00
EXTENSION ANA - DOBLE TRENZA;4827,90;10301624;3,00
PINCHOS PARA CATERING *10cm* - Bolsa x 100 un.;2444,59;10301706;0,00
PELUCA CORTO AZUL;7213,54;10301710;1,00
PELUCA CORTO CASTAÑO;7213,54;10301711;20,00
PELUCA CORTO MULTICOLOR;7213,54;10301713;0,00
PELUCA CORTO NARANJA;7213,54;10301714;0,00
PELUCA CORTO NEGRO;7213,54;10301715;0,00
PELUCA CORTO PLATINADO;7213,54;10301716;0,00
PELUCA CORTO ROJO;7213,54;10301717;7,00
PELUCA CORTO ROSA;7213,54;10301718;0,00
PELUCA CORTO RUBIO;7213,54;10301719;6,00
PELUCA CORTO VERDE;7213,54;10301720;0,00
PELUCA CORTO VIOLETA;7213,54;10301721;0,00
PELUCA LARGO AZUL;8515,98;10301722;0,00
PELUCA LARGO CASTAÑO;8515,98;10301723;3,00
PELUCA LARGO MULTICOLOR;8515,98;10301725;0,00
PELUCA LARGO NARANJA;8515,98;10301726;11,00
PELUCA LARGO NEGRO;8515,98;10301727;0,00
PELUCA LARGO PLATINADO;8515,98;10301728;0,00
PELUCA LARGO ROJO;8515,98;10301729;1,00
PELUCA LARGO ROSA;8515,98;10301730;0,00
PELUCA  LARGO RUBIO;8515,98;10301731;0,00
PELUCA LARGO VERDE;8515,98;10301732;7,00
PELUCA LARGO VIOLETA;8515,98;10301733;0,00
PELUCA METALIZADA MULTICOLOR;3306,20;10301737;17,00
PELUCA "DRACULIN";5336,10;10301744;0,00
PELUCA "PRINCESITA";3206,02;10301745;0,00
PELUCA ONDULADO CELESTE;9217,30;10301748;0,00
PELUCA ONDULADO MULTICOLOR;9217,30;10301750;0,00
PELUCA ONDULADO NARANJA;9217,30;10301751;2,00
PELUCA ONDULADO NEGRO;9217,30;10301752;0,00
PELUCA ONDULADO ROJO;9217,30;10301754;2,00
