Descripcion;Precio_Venta_Final;IdArticulo;Stock
GUIRNALDA CALABAZAS HALLOWEEN CON LUZ  x1 PA0754 CA;8059,28;13800953;0,00
GUIRNALDA CALAVERA HALLOWEEN CON LUZ  x1 PA0755 CA;8954,75;13800954;0,00
GUIRNALDA MOMIA HALLOWEEN CON LUZ  x1 PA0757 CA;8954,75;13800956;0,00
ADORNO PUERTA HALLOWEEN BRILLO VARIOS MODELOS x1 PA0773 CA;2573,19;13800959;39,00
VELA CANDELABRO 18cm ( PAR ) x2 PA0885 CA;5460,94;13800962;0,00
COLGANTE FUEGO HALLOWEEN   x1 PA0945 CA;43357,01;13800963;0,00
CANDELABRO CALAVERA Y VELA METAL CON LUZ  x1 DA0024 CA;7731,42;13800983;0,00
CANDELABRO ESQUELETO 3 VELAS METAL CON LUZ  x1 DA0028 CA;34771,99;13800986;0,00
ARAÑA NEGRA PLASTICA HALLOWEEN x1 DA0237 CA;2740,19;13800994;1,00
GALERA NEGRA MAGO/CABALLERO x1 DA0645 CA;9577,28;13801010;4,00
APLIQUE MARIPOSA BRILLO CALADA 3D PARA TORTAS ADHESIVA x12 YW17012;1470,15;13801034;-1,00
BANDERIN HOMBRE ARAÑA x1  C.O;3359,78;13801053;2,00
SERVILLETA MARGARITA x20 C.O;3196,08;13801055;4,00
PLATO DRAGON MARGARITA x8 C.O;3133,51;13801056;4,00
PIÑATA CARTON MARGARITA x1 C.O;5326,02;13801057;3,00
MANTEL MARGARITA (1.20x1.80) x1 C.O;5354,90;13801058;2,00
AFICHE FELICIDADES MARGARITA C.O. x1;2779,74;13801066;5,00
SET PIRATA (parche-aro-pañuelo) x1 MM45-05;2664,09;13801079;0,00
SERPENTINA AEROSOL NASHVILLE CARIOCA MULT/COLOR ;2941,51;13801080;15,27
PAPEL ANTIADHERENTE PARA HORNO REUTILIZABLE;2523,61;13801082;10,00
GLITTER EN GEL ROJO 20 GRAMOS x U;1942,94;13801083;-21,00
DISFRAZ MAGO/HECHICERO CROSTI x1 T3;15191,55;13801118;3,00
GLOBO GLOBOX PERLADO 12" PLATINUM x50 71781;10179,46;13801168;11,74
GLOBO GLOBOX PERLADO 12" CREAM x50  71811;10179,46;13801170;18,88
BANDERIN CON STAMPING FELIZ CUMPLEAÑOS BLANCO x1 3360-10 GM;2508,45;13801172;0,00
TUTU  HALLOWEEN ESTAMPADO VARIOS MODELOS x1 YJ0678;4204,63;13801262;0,00
TUTU  HALLOWEEN SANGRIENTO x1 YJ0680;6703,88;13801263;0,00
GORRO PIRATA SIMIL CUERO x1 YJ0682;9414,41;13801264;0,00
CANDELABRO ESQUELETO 3 VELAS CON LUZ PA0332 x U;5971,35;13801267;9,00
BICARBONATO DE AMONIO ALZOL x100g;469,19;13801270;28,00
ADORNO SET FELIZ CUMPLE 3D MARGARITA x3u.UPALALA;2241,16;13801272;4,00
ADORNO TORTA BASE GIBREADA MARGARITA x1u.UPALALA;1742,40;13801273;2,00
PLANCHA CON MALLA SILPAT MACARONS (30x20 ) x1;8211,06;13801293;4,00
EMBUDO DE SILICONA PLEGABLE 7 cm x 6.5 ALTO COLORES SURTIDOS (117335);3394,05;13801319;7,00
VINCHA CON OREJA BURRO x U;1387,82;13801340;0,00
PIÑATA GLOBO SUPER 24" LISA AZUL ;2162,32;13801343;1,00
MOGUL MONSTRUITOS 12X30GR;8592,01;13801345;0,00
BANDERIN HAPPY BIRTHDAY CORONITA ROSA x1 U24-012/CL711-1;2642,64;13801360;0,00
GORRO MAQUINISTA GIGANTE JAMAICA ROX x1 art.333;8167,50;13801416;4,00
BASE EXHIBIDORA PREMIUM PARA 19 GLOBOS x1 52584B;10259,29;13801429;3,00
MOLDE DE SILICONA PARA 12 CUPCAKES COLOR  x1;7635,76;13801432;0,00
SILICONA LIQUIDA TRANSPARENTE x30 ml. RYR-30 (CAJA x24);22920,26;13801434;0,46
CORTINA METALIZADA BLANCO ( 2.00 x1.00 mts ) x1 70920 COTI;1914,77;13801492;18,00
CORTINA METALIZADA LILA ( 2.00 x1.00 mts ) COTI;1823,59;13801493;2,00
CORTINA DILAX PASTEL ROSA ( 2.00 x1.00 mts ) COTI;1914,77;13801496;2,00
TANZA ELASTICA 10mts APROX. N°5  ;1361,36;13801520;-1,00
BURBUJERO  ASTRONAUTA CON LIQUIDO EXTRA DURACION DE BURBUJAS x48 U23-1004;28738,71;13801527;6,00
GOMITAS MOGUL CEREBRITOS 12X30GR;9428,85;13801553;2,33
GLOBO GLOBOX CROMO REFLEX 12" PLATA x10 71842;3744,46;13801566;0,00
GLOBO GLOBOX CROMO REFLEX 12" DORADO  x10 71859;3744,46;13801567;-10,00
GLOBO GLOBOX CROMO REFLEX 12" ROSA GOLD  x10 71866;3744,46;13801568;0,00
GLOBO GLOBOX CROMO REFLEX 12" AZUL x10 71873;3744,46;13801569;0,00
GLOBO GLOBOX CROMO REFLEX 12" FUCSIA x10 71880;3744,46;13801570;7,00
GLOBO GLOBOX CROMO REFLEX 12" VERDE x10 71897;3744,46;13801571;-1,00
GLOBO GLOBOX CROMO REFLEX 12" PURPURA x10 71903;3744,46;13801572;0,00
MOÑO NAVIDEÑO DE TELA DORADO/PLATEADO 20X24cm.X1 UNIDAD ART.53358;5821,79;13801613;5,00
BLISTER VELAS TORNEADAS CON PORTAVELA 7cm SURTIDAS x10u JK101;515,31;13801617;22,00
BOCHAS NAVIDEÑAS N°6 TONOS PASTEL X6 UNIDADES ART.53695;11702,39;13801621;2,00
CORONA DE NAVIDAD PLATEADA/VERDE PINO DECORADA 30cm X 1 UNIDAD ART.660;22198,18;13801636;0,00
BOA NAVIDEÑA RULO METALIZADA CON VERDE PINO 50mm.X 2MTS ART.1345/2;1341,65;13801638;2,00
COPA NANCY CHAMPAGNE CRISTAL 032 x5;3290,17;13801658;2,00
CHUPETIN PICO DULCE LHERITIER LED X24;7009,55;13801659;0,00
CAÑON CARIOCA EGRESADOS x1;6242,06;13801697;0,00
ADORNO CON BASE FELIZ CUMPLEAÑOS STITCH x1 u.CREACIONES PAU;4026,53;13801702;0,00
ADORNO CON BASE FELIZ CUMPLEAÑOS SONIC x1 u.CREACIONES PAU;4026,53;13801703;0,00
ADORNO CON BASE FELIZ CUMPLEAÑOS UNICORNIO x1 u.CREACIONES PAU;4026,53;13801704;0,00
ADORNO ENCASTRE CON BASE FELIZ CUMPLE KUROMY Y MELODYx1u.(POMPI DU);2831,40;13801706;0,00
ADORNO ENCASTRE CON BASE FELIZ CUMPLE SONIC x1u.(POMPI DU);2831,40;13801709;0,00
ADORNO ENCASTRE CON BASE FELIZ CUMPLE STITCH x1u.(POMPI DU);3506,58;13801739;0,00
ADORNO ENCASTRE CON BASE FELIZ CUMPLE FROZEN x1u.(POMPI DU);3506,58;13801746;0,00
CORONA NAVIDEÑA RUSTICA CON DETALLES EN DORADO 25cm. X 1 ART.32031;18816,05;13801875;0,00
CORONA NAVIDEÑA RUSTICA CON DETALLES EN PLATEADO 29cm. X 1 ART.32033;20837,49;13801877;1,00
PASTA SABOR PISTACHO TOP CLASS x1.25Kg  1660;80434,00;13801882;0,00
PICO/BOQUILLA REDONDA PARPEN x1 C18;8048,54;13801894;0,00
TARTERA INDIVIDUAL ANTIADHERENTE 8cm  B1946 x U;1550,53;13801918;22,00
DROPS  PERLAS MEDIANAS ROSA PASTELAR x50grs;2447,59;13801921;16,00
PERLAS COMESTIBLES BLANCAS LAUACU 20gr x U;1792,59;13801923;-1,00
BOCHAS NAVIDEÑAS N°5 BRILLANTE/MATE/TEXTURADA COMBINADAS AZUL/TURQ/PLATA X3;34414,58;13801978;1,00
BOCHAS NAVIDEÑAS N°5 BRILLANTE/MATE/TEXTURADA COMBINADAS VIOLETA X34 UNIDAD;40399,72;13801979;0,00
BOCHA NAVIDEÑA 2 BRILLANTE/2 SATINADA/2 GIBRIADA COLORES SURTIDOS 70mm x6 U;17026,95;13801985;6,00
SERVILLETA RAYADA DORADA x20u. C.O;2741,10;13801989;6,00
GIBRE EN TUBITOS METALIZADO NEGRO ;846,38;13802000;0,00
BRILLANTINA COMESTIBLE FUCSIA PASTELAR ;565,71;13802001;47,00
DISCO CARTON SOL ROJO 20 cm x10 RAF 6430;3350,05;13802015;2,00
DISCO CARTON SOL ROJO 30cm x10 RAF 5599;6444,75;13802017;1,00
DISCO CARTON SOL ROJO REFORZADO 34cm  x10 RAF 5684;10754,79;13802018;3,00
DISCO CARTON SOL VERDE 20 cm x10 RAF 6430;3350,05;13802021;3,30
DISCO CARTON SOL VERDE 26 cm x10 RAF 5599;5210,04;13802022;3,00
DISCO CARTON SOL VERDE 30cm x10 RAF 5599;6444,75;13802023;3,10
DISCO CARTON SOL VERDE REFORZADO 34cm  x10 RAF 5684;10754,79;13802024;0,40
BANDA DESPEDIDA DE SOLTERA x1;1507,83;13802034;1,00
GORRO CORSARIO SIMIL CUERO x1 PA1118;12052,70;13802063;0,00
ANTEOJO VINTAGE A RAYAS x1 PA1228;2904,00;13802067;0,00
GORRO COWBOY TEXANO LISO PREMIUN x1 PA1052;10013,57;13802070;0,00
ANTEOJO LENNON GRANDE COLOR  x1 PA0033;2857,49;13802087;-44,00
SET HIPIEE 5 PIEZAS PREMIUN x1 PA0129;27230,01;13802101;0,00
SET MAGO / HARRY POTTER 2 PIEZAS x1 PA0130;3809,39;13802102;1,00
SET MARIPOSA BLANCA (VARITA - VINCHA - ALA)  x1 PA0134-01;6844,15;13802104;2,00
ANTEOJO RECTANGULAR METAL COLOR  x1 PA0189;2899,87;13802111;0,00
SET VINCHA Y VARITA LENTEJUELAS MULTICOLOR  x1 PA0236;5422,70;13802115;2,00
ANTEOJO PIXEL VARIOS COLORES x6 PA0387;19962,28;13802130;0,00
ANTEOJO PIXEL CON LUZ  x1 PA0396;5445,00;13802134;0,00
SET VINCHA Y FAJA FELIZ CUMPLEÑOS METAL x1 PA0479;6666,44;13802137;0,00
SET DE GLOBO FLOR 9 PIEZAS x1 PA0509;6710,59;13802139;0,00
ANTIFAZ CONEJA ROMBOS CON BRILLO x1 PA0517;4849,32;13802143;7,00
ANTIFAZ GATITA LENTEJUELA TORNASOL x1 PA0519;5118,72;13802144;1,00
MOÑO RAPIDO ROSAS ROSA 70mm x 40cm x10u. PA0636-01;7541,89;13802155;1,70
GORRO FUNYI TELA METAL ESTRELLAS x1 PA1031;7015,51;13802165;1,00
GORRA FRENTE CON STRASS COLOR x1 PA1047;17327,60;13802168;1,00
GORRA SIMIL CUERO Y APLIQUE PREMIUN x1 PA1057;8639,40;13802170;2,00
CAPELINA PLAYERA TEJIDO ESTAMPADA x1 PA1110;12655,03;13802182;3,00
GORRO GAUCHO PAISANO PREMIUN x1 PA1114;13559,27;13802183;0,00
TUTU TULL TORNASOL CORAZON NEGRO x1 PA0140-02;6327,67;13802188;0,00
MOÑO RAPIDO BLANCO 70mm x 40cm x10u. PA0638-01;7780,49;13802199;1,20
SET MOÑO Y CINTA DORADA x1 PA0688-01;4882,13;13802200;2,00
SET MOÑO Y CINTA PLATA  x1 PA0688-02;4393,92;13802214;6,00
PLATO SONIC x8 C.O;3133,51;13802247;6,00
SILBATO CON LUZ  LED x12 YJ0363;12996,13;13802249;0,00
PULSERA DE GOMA HAPPY CON LUZ LED x6 YJ0711;8664,08;13802251;13,00
TUTU MULTICOLOR x1;6090,10;13802282;0,00
SET PIRATA x1 (2 piezas) HM70015;4507,20;13802308;1,00
CUBO MAGICO x1 HM40061;2114,62;13802322;0,00
BOTA NAVIDEÑA DE PAÑO ROJA FELIZ NAVIDAD 45 cmX1 ART.53593;7056,72;13802328;0,00
VINCHA FLORES DE TELA MULTICOLOR  x1 PA0217;4972,25;13802330;1,00
MUÑECO NAVIDEÑO PAPA NOEL SURTIDO BLANCO/ROJO 19X30cm.X1 ART.301045;42471,00;13802387;2,00
CARETA PLASTICA DEADPOOL ;1490,98;13802423;2,00
GIBRE EN TUBITOS FLUO NARANJA;654,16;13802424;25,00
PAPA NOEL/MUÑECO DE NIEVE COLGANTE CON FRASE 40cm.X1 ART.53579;25482,60;13802517;2,00
MUÑECO NAVIDEÑO PAPA NOEL/RENO/MUÑECO DE NIEVE 20cm.X1 ART.53580;12806,64;13802518;2,00
GORRO PILUSO FLUO VARIOS COLORES x1 MM168-10;5971,15;13802530;0,00
AFICHE FELIZ CUMPLE HOMBRE ARAÑA x1  C.O;2946,51;13802574;14,00
ESTRELLITAS (CAJA 20x5und.) RR  2250/IO7;6629,76;13802575;0,05
MOLDE PAPEL FREIDORA AIRE REDONDO GRANDE AIR FRYER x 50 B1636;5662,80;13802609;0,00
ADORNO TORTA BASE GIBREADA AUTOS DE CARRERA  x1u.UPALALA;2308,24;13802619;0,00
PLANCHA CON MALLA SILPAT (30x40 ) x1 BM3526;6073,26;13802632;2,00
VINCHA PLASTICA FLUO CORAZON CHICA  x4u.;3430,35;13802661;4,75
VINCHA PLASTICA FLUO CON ESTRELLAS  x4u.;3601,87;13802662;6,75
VINCHA PLASTICA FLUO CARITAS SMILEY  x4u.;3430,35;13802663;7,00
VINCHA PLASTICA FLUO MARIPOSA  x4u.;4116,42;13802664;7,75
TUTU ABEJITA  x1 JB 1870;6470,89;13802689;5,00
STICKERS EN PLANCHA FORMULA 1 (plancha 2 x 12) C.O;1506,55;13802702;3,00
BANDERIN FORMULA 1 x1 C.O;2729,67;13802703;3,00
PLATO CUADRADO CHICO FORMULA 1 x8u. C.O;2599,23;13802704;1,00
SERVILLETA FORMULA 1 x20u. C.O;2596,83;13802705;0,00
VASO POLIPAPEL FORMULA 1 240 cc x8 C.O;2655,31;13802706;0,00
CINTA DE PAPEL 15 MM X 15 MTRS X 18U (104080);0,00;13802722;0,00
BOA NAVIDENA VERDE PINO Nº10 2mts (110009);2683,30;13802723;4,00
SET 6 MOÑOS FLOR CON PEGAMENTO Y CINTA (104186);7830,22;13802724;3,00
ANTIFAZ PAÑO  CEBRA;2789,45;13802725;59,00
ANTIFAZ PAÑO CONEJITO;2789,45;13802726;55,01
ANTIFAZ PAÑO ELEFANTE;2789,45;13802727;62,01
ANTIFAZ PAÑO JIRAFA;2789,45;13802728;60,00
ANTIFAZ PAÑO LEOPARDO;2789,45;13802729;57,00
BARRITA DE CARAMELO CABLE FRUTILLA ACIDA BULL DOG;487,87;13802737;46,04
PINCHE POLIFAN VINILO FELIZ DIA INTENSAMENTE;1327,59;13802738;2,00
DISCO CARTON SOL ROJO REFORZADO 34cm ;1075,48;13802739;30,00
DISCO CARTON SOL VERDE REFORZADO 34cm;1075,48;13802740;4,00
ROSITAS PORCELANA FRIA ROSA;1411,67;13802741;0,00
HILO YUTE NATURAL CHICO 2mm 60grs 20m;2651,83;13802742;0,00
STICKERS EN PLANCHA EGRESADOS;1001,13;13802743;19,00
ESPATULA 100 % SILICONA 27cm x1 BM0661;3676,47;13802751;-4,00
SOPLETE PARA REPOSTERIA x1 915;9227,22;13802752;0,00
SOPLETE PARA REPOSTERIA ( PICO METAL) x1 8812;14417,54;13802753;7,00
PINTURA AEROSOL PARA PELO NASHVILLE CRAZY COLOR AMARILLO x12u.;28050,46;13802764;1,58
PINTURA AEROSOL PARA PELO NASHVILLE CRAZY COLOR AZUL x12u.;28050,46;13802765;1,00
PINTURA AEROSOL PARA PELO NASHVILLE CRAZY COLOR FUXIA x12u.;28050,46;13802768;0,00
PINTURA AEROSOL PARA PELO NASHVILLE CRAZY COLOR ROJO x12u.;28050,46;13802771;0,08
PINTURA AEROSOL PARA PELO NASHVILLE CRAZY COLOR VERDE x12u.;28050,46;13802772;2,50
PINTURA AEROSOL PARA PELO NASHVILLE CRAZY COLOR VIOLETA x12u.;28050,46;13802773;0,00
CUCHARA 100 % SILICONA TRICOLOR 20.5 cm x1 DL15545;4565,63;13802836;10,00
JERINGA INYECTORA 100% ACERO x1 DL15550;11583,63;13802839;1,00
CREMA LEMON LEDEVIT  x250gr;6097,86;13802851;0,00
CHEESECAKE LEDEVIT  x300gr;5299,09;13802852;0,00
VASO DE POLIPAPEL MOANA 2 C.O x8;3372,74;13802860;4,00
PLATO MOANA 2 C.O x8;3133,51;13802862;6,00
PIÑATA CARTON MOANA 2 C.O x1;5645,57;13802864;7,00
MANTEL MOANA 2 (1.20x1.80) C.O x1;8664,08;13802865;3,00
BOLSA MOANA 2 C.O x10;3489,70;13802868;7,00
BANDERIN MOANA 2 C.O x1;3359,78;13802869;2,00
AFICHE FELIZ CUMPLEAÑOS MOANA 2 C.O x1;2946,51;13802872;4,00
GORRA COLOR CON LENTEJUELAS x1  MM205-03;7699,30;13802883;1,00
PERLAS COMESTIBLES LILA LAUACU  ;1937,94;13802890;0,00
CORTANTE MARCADOR PLASTICO 3D F1 AUTO/CASCO x1 DESIGN;2093,93;13802898;1,00
GORRO COWBOY SHERIFF CON FELPA MARRON x1 YW17103 (112895);2491,04;13802948;14,00
VINCHA FELIZ AÑO NUEVO CON BRILLO x12 DG1754A;7623,00;13802954;0,00
CASCANUECES 12.5cm CAJA X6 SURTIDOS 32122;48924,85;13802977;0,00
CASCANUECES ROJO 15cm x1 VARIOS MODELOS 32125;15582,22;13802980;0,00
MOLDE BUDIN CON FLEJES 250grs. x10un;1837,25;13803005;-2,00
POLVO BOMBUCHA MULTICOLOR  ;1041,78;13803006;32,00
ESENCIA FLEIBOR AGUA DE AZAHAR A GRANELx30cc;2257,76;13803008;0,00
BARRITA SMACK X30GR;356,57;13803010;0,00
ADORNO SET FELIZ CUMPLE 3D MOANA x3u.UPALALA;2502,63;13803037;0,00
GLOBO ESFERA LASER (VARIOS COLORES) 22" x1 CL683/D2213;2774,77;13803044;25,00
GLOBO FLOR MARGARITA (71x71 aprox) x5 U22-714;10482,47;13803057;3,00
SET UNTADORES DE ACERO 10cm  x6 202163;3283,29;13803113;4,00
MOLDE SILICONA PARA FREIDORA DE AIRE 19.5x16.5cm x1 202603;4481,48;13803114;0,00
MOLDE SILICONA PARA FREIDORA DE AIRE 20.5x17.5cm x1 202626;5032,03;13803116;0,00
CHAUCHA DE VAINILLA CUMANA x1 20810;9561,35;13803133;2,00
VASO TRAGO LARGO FLEXIBLE PP ROJO  x 10;3788,89;13803136;17,00
ESPATULA SILICONA 21cm x1 BM1479;2123,31;13803193;0,00
MOLDE SILICONA PALETA HELADO LISA 8x5 BM0485 (123134);5646,61;13803253;16,00
BANDERIN CON STAMPING FELIZ CUMPLEAÑOS MULTICOLOR  x1 3360-11 GM;2006,76;13803296;0,00
CARETA PLASTICA ELEFANTITO;1598,64;13803300;7,00
GOMITAS YUMMY OSITOS DISPLAY (12unidx30gras) x1;8539,24;13803302;0,17
GOMITAS YUMMY DINO DISPLAY 30GR;837,18;13803303;48,02
GOMITAS YUMMY OSITOS DISPLAY 30GR;837,18;13803304;2,01
MOÑO RAPIDO BLANCO 70mm x 40cm;576,33;13803309;12,00
GORRO ALMIRANTE PLATA GEMAS Y STRASS CON LUZ VARIOS MODELOS x1 RM;14157,00;13803333;1,00
MOÑO RAPIDO ROJO 70mm x 40cm;1194,14;13803471;0,00
VELA PERLADA 20cm AZUL;1464,93;13803474;9,00
GORRO COWBOY GAMUZA CON LENTEJUELAS Y CORONA x1 YJ0736;9909,90;13803498;0,00
MOÑO RAPIDO ROSAS ROSA 70mm x 40cm x1;837,99;13803517;17,00
CORONA REY x1 Art 271;20582,10;13803518;1,00
PINTURA AEROSOL PARA PELO NASHVILLE CRAZY COLOR DORADO x12u.;28050,46;13803530;1,33
PINCHE CORAZON GRANDE TE AMO/FELIZ DIA/LOVE MODELOS SURTIDOS x1u.(POMPI DU ;2735,81;13803553;0,00
CORTINA CUADRADITOS BRICK WALL FLUO VARIOS COLORES (1.00 x2.00 mts) x1 U24-;3567,56;13803570;0,00
KIT DE GLOBOS CARAMELOS Y LUNARES 96 PIEZAS x1;21725,55;13803577;1,00
APLIQUE PASTILLAJE PARA HUEVO ZANAHORIA CHICA x25 UNIDADES;3767,88;13803596;0,00
APLIQUE ANIMALITO PASTILLAJE PARA HUEVO CISNE ROSA x8 UNIDADES;4451,83;13803599;1,00
APLIQUE ANIMALITO PASTILLAJE PARA HUEVO CISNE CELESTE x8 UNIDADES;4451,83;13803600;1,00
CHOCOLATE CHOCOLART SEMIAMARGO (BULTO8x500grs.) 213/CA500;53361,00;13803614;2,81
VINCHA PLASTICA FLUO FLOR MARGARITA  x4u.;3430,35;13803618;34,75
BURBUJERO ESTRELLA MINI TUBO x10 1930;6469,19;13803701;0,00
SORBETE CON FORMA FRUTAS x4 CD26285;5096,52;13803709;0,00
SORBETE CON FORMA FRUTAS x4 CD26286;5096,52;13803710;0,00
VARIEGATO FRAMBUESA TOP CLASS  x250grs;12491,83;13803720;3,00
DISFRAZ OFICIAL MOANA T0x1  (3-4años);56927,26;13803724;1,00
DISFRAZ OFICIAL MOANA T1x1  (5-6años);56927,26;13803725;4,00
DISFRAZ OFICIAL MOANA T2x1 (7-8años);56927,26;13803726;1,00
ESFERA TELGOPOR Nº4 x2;355,56;13803743;122,00
ESFERA TELGOPOR Nº7  x2;1272,89;13803744;49,05
ADORNO/APLIQUE ESCUDO GRANDE DIABLOS;1778,70;13803745;7,00
NIEVE CARNAVAL REY MOMO 380cm ;2887,22;13803749;0,00
ESPATULA SILICONA (28cm) E01/22012-BM0015 (00107896);3760,00;13803753;12,00
VELA PERLADA VARIOS COLORES x U;363,20;13803754;148,00
GORRO COWBOY SHERIFF CON FELPA NEGRO x1 YW17103 (112894);2491,04;13803755;7,00
GALERA FLUO IMPORTADA x12 YW17100 FUCSIA (112859);20711,69;13803756;4,67
GALERA FLUO IMPORTADA x12 YW17100 AZUL (112858);20711,69;13803757;4,25
GALERA FLUO IMPORTADA x12 YW17100 AMARILLO (112857);20711,69;13803758;4,67
GALERA FLUO IMPORTADA x12 YW17100 NARANJA (112860);20711,69;13803759;4,00
GALERA FLUO IMPORTADA x12 YW17100 VERDE (112856);20711,69;13803760;3,83
PASA DE UVA SIN SEMILLA x200g;1838,72;13803764;1,00
GLOBO BOTELLA  CHAMPAGNE 34" x1;1955,30;13803805;0,00
PULSERA CABLE MULTICOLOR CHICA x 10 0964;2954,48;13803835;31,00
RALLADOR DE CITRICOS 27 cm x1 0589/851;1727,57;13803861;9,00
REPUESTO GAS BUTANO SUN 227ml x1;5791,73;13803892;0,00
MANI CON CHOCOLATE ARGENFRUT x 100 gramos;2118,74;13803896;-2,00
GELATINA SIN SABOR ALZOL x50G;1831,03;13803897;30,00
GALERA ALTA BOCA CON FLECOS MURGUERO x1;11532,51;13803900;0,00
GALERA BAJA BOCA CON FLECOS MURGUERO x1;10650,42;13803902;1,00
ESPATULA METAL 43 cmx1 RP5136;3707,37;13803906;0,00
ANTIFAZ GATO FLUO PLASTICO x12 YJ0702;5715,94;13803942;15,00
VINCHA FLORES MARGARITA MULTICOLOR;2917,52;13803944;0,00
CINTA METALIZADA Y BRILLO VARIOS COLORES;1864,05;13803949;11,01
VINCHA CON OREJA JIRAFA ;1506,63;13803950;8,00
VINCHA CON OREJA VACA ;1506,63;13803951;2,00
GALERA ALTA FLUO CON FLECOS MURGUERO x1;11532,51;13803964;4,00
GALERA ALTA FLUO BICOLOR CON FLECOS MURGUERO x1;11532,51;13803965;3,00
GALERA BAJA FLUO BICOLOR  CON FLECOS MURGUERO x1;9585,38;13803967;1,00
VASO AMERICANO ROJO BELLA CUP 590cc x50;15390,70;13803973;25,20
VASO AMERICANO AZUL BELLA CUP 590cc x50;15390,70;13803975;21,80
ESTRELLA PASTILLAJE GRANDE AMARILLA x15u.;4700,85;13804001;0,00
ESTRELLA PASTILLAJE GRANDE AZULx15u.;4700,85;13804002;1,00
ESTRELLA PASTILLAJE GRANDE BLANCAx15u.;4700,85;13804003;0,00
ESTRELLA PASTILLAJE GRANDE CELESTE x15u.;4700,85;13804004;0,00
ESTRELLA PASTILLAJE GRANDE ROJO x15u.;4700,85;13804005;0,00
ESTRELLA PASTILLAJE GRANDE ROSA x15u.;4700,85;13804006;0,00
ESTRELLA PASTILLAJE GRANDE COMBINADAS BOCA x15u.;4700,85;13804007;0,00
ESTRELLA PASTILLAJE GRANDE COMBINADAS RIVER x15u.;4700,85;13804008;0,00
SET DE GLOBOS PERSONAJE KUROMI 5 PIEZAS  x1;5816,15;13804019;0,00
GLOBO FRASE TE AMO x1;2664,82;13804022;0,00
SET DE GLOBOS ARCO IRIS PASTEL 5 PIEZAS x1;4835,53;13804030;0,00
SET DE GLOBOS GASEOSA COLA 5 PIEZAS x YOMI;4854,52;13804036;0,00
CORONA DE REINA AJUSTABLE PLASTICA x1;2998,02;13804046;0,00
AFICHE FELIZ CUMPLE CAPIBARA CALUMI x2u.;3645,97;13804061;0,00
ADORNO PINCHE SET FELIZ CUMPLE CAPIBARA CALUMI x3u.;2456,30;13804062;0,00
GORRO COWBOY SHERIFF NEGRO x1 MM134-52;7556,70;13804134;0,00
GORRO COWBOY SHERIFF MARRON x1 MM134-53;7682,89;13804135;0,00
CHOCOLATE CHOCOLART LECHE x500grs. 223/CA500;6670,13;13804232;18,00
VASO DE  POLIPAPEL KITTY x8 C.O;3372,74;13804239;4,00
SERVILLETA KITTY x20 C.O;3196,08;13804240;2,00
PLATO KITTY x8 C.O;3133,51;13804241;7,00
PIÑATA CARTON KITTY x1 C.O;5645,57;13804242;5,00
MANTEL KITTY (1.20x1.80) x1 C.O;8664,08;13804243;2,00
BOLSA KITTY x10 C.O;3489,70;13804246;0,00
BANDERIN KITTY x1 C.O;3359,78;13804248;5,00
STICKERS EN PLANCHA KITTY (2 x12) C.O;1609,52;13804249;8,00
AFICHE FELIZ CUMPLE KITTY x1 C.O;2946,51;13804251;5,00
VASO POLIPAPEL CORAZONES 240 cc x8 C.O;2413,92;13804252;18,00
DISFRAZ NEON x1 94 PIEZAS JY0709;6115,82;13804260;0,00
CORONA REY AJUSTABLE DORADA/PLATA  ;2015,86;13804268;-14,00
MOLDE SILICONA PARA VELA/JABON HOJAS SURTIDAS x1 BM1496;6589,76;13804277;1,00
MOLDE SILICONA PARA VELA/JABON FLOR SURTIDAS x1 BM2014;8544,76;13804278;0,00
MOLDE SILICONA 4 CUBOS SURTIDOS x1 S1710/BM3346;4448,85;13804292;0,00
CHOCOLATE CHOCOLART LECHE ( BULTO8x500grs) 223/CA500;53361,00;13804302;2,25
CARAMELO MASTICABLE YOGURT BILLIKEN x600grs.;7468,27;13804316;23,00
PINCHE POLIFAN VINILO FELIZ DIA SUPER CAMPEONES ARGENTINA;1241,28;13804317;3,00
LUNCHERA LUNCH COLOR CON CUBIERTO x1 0213;12772,76;13804331;0,00
BLISTER VELA PINCHE CORONITA PASTEL COLORES SURTIDOS x5 CL798/U24-368;1565,76;13804354;1,00
SOMBRERO COWBOY BLANCO Y ROSA x1 ILC32;7371,42;13804385;0,00
BLISTER VELA PINCHE ESTRELLA PASTEL COLORES SURTIDOS x5 CL799/U24-369;1739,74;13804419;0,00
COLLAR HAWAIANO MULTICOLOR x12 YW19-276;5172,42;13804431;-1,00
BOLSA REGALO ESTAMPADA CORAZONES  ILC14 ;1954,46;13804437;0,01
BOLSA REGALO ESTAMPADA LUNARES ILC17 ;2003,71;13804438;0,01
BOLSA REGALO ESTAMPADA MOÑO ILC11 ;1991,67;13804439;0,00
BOLSA REGALO ESTAMPADA MOÑO GRANDE ILC16;2011,98;13804440;0,01
GLOBO I LOVE YOU TRES CORAZONES x1 LX;3187,31;13804452;0,00
GLOBO MARGARITA 18" VARIOS COLORES x10;0,00;13804457;0,00
GLOBO CHOPP CHEERS 26" x1;2066,92;13804461;0,00
ADORNO SET FELIZ CUMPLE 3D CAPIBARA x3u.UPALALA;2744,28;13804463;0,00
LAMINA COBRE PARA REPOSTERIA x1 FLORYMIA;8028,98;13804468;6,00
PLACA ANTIADHERENTE DORADA PARA 6 CUPCAKE x1 RP5170-1;7029,42;13804484;4,00
CHOCOLATE COBERTURA COLONIAL SEMIAMARGO x500gr 031-30273;19511,49;13804501;3,00
SERVILLETA BOCA x20u. C.O;3196,08;13804508;3,00
GLOBO FLOR MARGARITA 50x50cm x U;1430,99;13804511;3,00
ESENCIA FLEIBOR FRAMBUESA ;2132,33;13804512;7,00
GUIRNALDA MARGARITAS COLORES SURTIDOS;3415,10;13804513;1,00
SPRINKLES DECOR MAGIC CORAZON MIX ROSA/BLANCO/ROJO x50grs;1340,48;13804514;-40,00
GOMITAS EUCALIPTUS BILLIKEN x800gr;10876,76;13804529;0,88
MOLDE PARA HELADO CORAZON X6;5505,50;13804531;-8,00
BONETE HAPPY BIRTHDAY POMPON CELESTE;1981,98;13804532;-9,00
BONETE HAPPY BIRTHDAY POMPON AMARILLO;1981,98;13804533;0,00
BONETE HAPPY BIRTHDAY POMPON ROSA;1981,98;13804534;0,00
BONETE HAPPY BIRTHDAY POMPON VIOLETA Y CELESTE;1981,98;13804535;0,00
BONETE HAPPY BIRTHDAY POMPON VIOLETA;1981,98;13804536;0,00
LUNCHERA YUMMY COLOR CON CUBIERTO 1400ml x1 0250;16054,04;13804552;0,00
APLIQUE MARIPOSA 3D METALIZADA/IRIDISCENTE CALADA P/TORTAS ADHESIVA x12 YJ7;1421,32;13804558;-5,00
PINCHE SAN PATRICIO GRANDE MODELOS SURTIDOS x1u.(POMPI DU );2591,82;13804559;2,00
SILBATO PLASTICO PELOTA IMPORTADO x100 YJ0058;22493,30;13804564;2,00
CORTANTE MARCADOR PLASTICO 3D CAPIBARA x1 DESIGN ( 127);1826,34;13804565;0,00
SET ANIMALES VINCHA, COLA Y MOÑO x1 ILC54;3376,59;13804569;-1,00
VINCHA PELUCHE CONEJO ROSA/BLANCO TORNASOL x1 ILC55;2176,46;13804570;0,00
FLOR MARGARITA DE PASTILLAJE SURTIDASX 8u;7367,96;13804574;0,00
LUNCHERA SPICY  COLOR CON CUBIERTO x1 BH36;15635,62;13804582;9,00
TUTU CON BRILLOS COLOR x1 YJ0365;5348,20;13804615;0,00
SET MARIPOSA (ALA, VINCHA, VARITA ) CON LUZ x1u. YJ0729;6061,37;13804633;-1,00
GLOBO NUMERO ANIMAL NUMBER Nº0 BUHO;1500,97;13804650;9,00
GLOBO NUMERO ANIMAL NUMBER Nº2  CIERVO;1500,97;13804651;7,00
GLOBO NUMERO ANIMAL NUMBER Nº3  PUMA  ;1500,97;13804652;5,00
GLOBO NUMERO ANIMAL NUMBER Nº4  TUCAN  ;1500,97;13804653;7,00
GLOBO NUMERO ANIMAL NUMBER Nº5 CEBRA ;1500,97;13804654;6,00
GLOBO NUMERO ANIMAL NUMBER Nº6   TORTUGA ;1500,97;13804655;8,00
GLOBO NUMERO ANIMAL NUMBER Nº7   COCODRILO ;1500,97;13804656;7,00
GLOBO NUMERO ANIMAL NUMBER Nº8 SERPIENTE  ;1500,97;13804657;10,00
GLOBO NUMERO ANIMAL NUMBER Nº9 TIGRE ;1500,97;13804658;9,00
PLACA PARA BOMBON/SOUVENIR CORAZONES VARIOS TAMAÑOS Nº1449 A. ;1014,40;13804659;10,00
GLOBO CORAZON 5" METALIZADO PLATEADO (100869);224,51;13804661;175,00
GORRO GALERA ALTA CON FELPA NEGRO;2235,00;13804663;5,01
TURRON MANI ARCOR x25gr (BULTO x50) 4013;17765,27;13804664;8,00
BRILLANTINA COMESTIBLE ROJO PASTELAR ;565,71;13804665;37,00
GLOBO CORAZON 10"METALIZADO ROJO ;270,97;13804666;50,00
CHOCOLATE AGUILA EN TABLETA AL 60% DE CACAO x100grs ;12212,05;13804667;8,00
GLOBO NUMERO ANIMAL NUMBER Nº1  x U;1500,97;13804668;0,00
BRILLANTINA COMESTIBLE AZUL PASTELAR ;565,71;13804669;19,00
BRILLANTINA COMESTIBLE LILA PASTELAR;565,71;13804671;20,00
BRILLANTINA COMESTIBLE PLATEADA PASTELAR;565,71;13804672;13,00
BRILLANTINA COMESTIBLE ROSA PASTELAR ;569,64;13804673;-3,00
BRILLANTINA COMESTIBLE VIOLETA PASTELAR;569,64;13804674;17,00
CARAMELO LENGUETAZO TUTTI-FRUTTI;375,52;13804675;3,14
BOMBON RAFFAELLO x3U;2782,16;13804676;0,00
CARAMELO MASTICABLE YOGURT BILLIKEN x600g (BULTO x12) ;65822,03;13804677;1,92
CHUPETIN MISTER POPS EVOLUTION SURTIDO (CAJA 12x24);74899,39;13804679;1,67
GALERON ALTO PAVO REAL CON LUZ  x1 Art 289;44104,94;13804684;1,00
GALERON ALTO CON LUZ  x1 Art 290;36753,75;13804685;1,00
BOMBO CRIOLLO CON PALITOS PATRIOS x1u.LM;16770,60;13804689;2,00
TAMBOR REDOBLANTE GRANADERO PATRIOS x1u.LM;19819,80;13804690;0,00
ACCESORIO FAROL PATRIOS x1uLM;7623,00;13804693;7,00
ACCESORIO BANDEJA CON PAVA Y MATE PATRIOS x1u.LM;16093,00;13804694;2,00
ACCESORIO BOTELLON DE LECHE PATRIOS x1u.LM;10672,20;13804696;1,00
TURBANTE FLUO x1;22052,47;13804713;6,00
TURBANTE CON PLUMA x1 Art 292;22052,25;13804714;3,00
SET 6 PICOS MANGA Y CUPLA x1;2640,87;13804744;0,00
MANTECOL UNTABLE x250grs;3242,99;13804749;0,00
PLATO REDONDO CARPINCHOS/CAPIBARA x8u. C.O;2599,23;13804752;0,00
SERVILLETA CARPINCHOS/CAPIBARA x20u. C.O;2596,83;13804753;0,00
STICKERS EN PLANCHA CARPINCHOS/CAPIBARA (plancha 2 x 12) C.O;1506,55;13804755;0,00
BANDERIN CARPINCHOS/CAPIBARA x1 C.O;2729,67;13804756;0,00
GOMITAS MOGUL DIENTES  2596 x U;2922,29;13804758;0,00
MALVAVISCO BUFFYS VAINILLA BLANCO (BULTO 12x200grs) ;40966,00;13804759;0,00
MALVAVISCO BUFFYS FRESA TWISTER  (BULTO 12x200grs) ;39054,26;13804760;0,00
GALERA SAN PATRICIO JERSEY 20cm ROX x1;5586,64;13804773;0,00
GALERON SAN PATRICIO JERSEY 24cm ROX x1;7759,22;13804774;0,00
DISFRAZ GATITA KITTY T.0 x1 ECHYZOS;17265,96;13804775;1,00
DISFRAZ GATITA KITTY T.1 x1 ECHYZOS;17265,96;13804776;0,00
DISFRAZ GATITA KITTY T.2 x1 ECHYZOS;17265,96;13804777;0,00
VINCHA CON FLORES Y PLUMAS  x1 Art 302;11107,80;13804778;3,00
CHOCOLATE MOLDATTE SEMIAMARGO (BULTO 12x500gr) 050-90273;92386,53;13804780;0,67
COLLAR FLORES SEDA SAN PATRICIO x1;6520,41;13804784;1,00
ANTEOJO CHOPP CERVEZA (SAN PATRICIO) x1 MM92-25;3669,32;13804803;0,00
ANTEOJO MARGARITA x1 MM92-27;1359,41;13804805;0,00
PALO DE AMASAR ANTIADHERENTE CON REGULADOR DE ALTURA 23cm x1 H15-005I15;4969,04;13804806;0,00
BANDERIN CARPINCHOS FELIZ CUMPLEAÑOSx1 GM;2219,94;13804831;0,00
PLATO CARPINCHOSx1 GM;3003,53;13804832;0,00
PLATO CHICO CELESTE x10;1962,92;13804836;34,00
PLATO CHICO NARANJA x10;1962,92;13804837;32,00
PLATO CHICO NEGRO x10;1962,92;13804838;-5,00
PLATO CHICO PASTEL AMARILLO x10;1962,92;13804839;45,00
PLATO CHICO CELESTE PASTEL x10;1962,92;13804840;15,00
