Descripcion;Precio_Venta_Final;IdArticulo;Stock
GLICERINA FLEIBOR  x1litro;13943,23;4207;0,00
MOLDE TORTERA ALUMINIO INDIVIDUAL ALT.11 cm. Nº20 MULTY x1;15981,79;4264;3,00
CREMA PASTELERA KEUKEN LODISER x 500gr. PCPA;8793,39;4273;0,00
AFICHE FELIZ CUMPLE SPIDEY Y SUS AMIGOS x1 C.O;2946,51;4351;4,00
BANDERIN SPIDEY Y SUS AMIGOS x1 C.O;3359,78;4353;0,00
PIÑATA CARTON SPIDEY Y SUS AMIGOS x1 C.O;5645,57;4360;5,00
PLATO SPIDEY Y SUS AMIGOS x8 C.O;3133,51;4361;1,00
PREMEZCLA LEDEVIT PARA BUDIN DE VAINILLA x 500gs;5603,19;4462;0,00
INFLADOR ELECTRICO ANIMAL x1 CL85/U23-251;25168,00;4479;0,00
VINCHA STRASS DELUXE BIRTHDAY GIRL (Cumpleañera ) x1;11760,90;4551;0,00
VINCHA STRASS DELUXE BRIDE TO BE (Futura novia) x1;11760,90;4552;0,00
VINCHA STRASS DELUXE FELIZ CUMPLEAÑOS (varios colores) x1;11760,90;4553;0,00
VINCHA STRASS DELUXE HAPPY BIRTHDAY (varios colores) x1;11760,90;4555;0,00
VINCHA STRASS DELUXE ME RECIBI (varios colores) x1;11760,90;4556;0,00
ADORNO CON BRILLO FELIZ CUMPLEAÑOS SPIDEY Y SUS AMIGOS x1 DESTELLOS;3963,96;4629;0,00
AFICHE FELICIDADES MASHA Y EL OSO x1 C.O;2946,51;4636;0,00
PIÑATA CARTON MASHA Y EL OSO x1 C.O;5645,57;4646;2,00
PLATO MASHA Y EL OSO x8 C.O;3133,51;4647;5,00
STICKERS EN PLANCHA MASHA Y EL OSO (plancha 2 x 12) C.O;1549,91;4649;0,00
VASO DE POLIPAPEL MASHA Y EL OSO x8 C.O;3372,74;4650;4,00
CHIZITOS PEIPO x300grs;6494,06;4667;8,00
CHIZITOS PEIPO x300grs (BULTO x10);46901,51;4668;0,80
FLOR DE AZUCAR DURAZNO MEDIANA MULTICOLOR X 50u.;3360,90;4728;-4,00
GORRA STRASS COLOR x1 MM207-02;27645,31;5053;0,00
VASO POLIPAPEL BLANCO 240 cc x8 ROMI PACK;1597,76;5070;15,00
CHOCOLATE CHOCOLART SEMIAMARGO x500grs. 213/CA500;6670,13;5073;22,50
CHOCOLATE MAPSACUBER CELESTE x3kg (BULTO6x500gr) 5883;47073,88;5152;-0,67
VELA BENGALA  DECORADA LOS AMIGOS DE KITTY (MY MELODY/KUROMI)x4;3458,12;5155;2,75
CHOCOLATE CHOCOLART BLANCO (BULTO8x500grs.) 233/CA500;53361,00;5227;1,94
CHOCOLATE CHOCOLART BLANCO x500grs. 233/CA500;6670,13;5228;15,50
CAÑON REVELACION DE GENERO ROSA/CELESTE x1;4445,39;5236;8,00
BOWL PLASTICO BLANCO PARA CHOCOLATE 28cm x1;6024,76;5272;13,00
BOWL PLASTICO CRISTAL PARA CHOCOLATE 28cm x1;6024,76;5273;9,00
VELA NUMEROTE BLISTER CON GIBRE FUTBOL BOSTERO Nº0  x1;1672,49;5299;6,00
VELA NUMEROTE BLISTER CON GIBRE FUTBOL BOSTERO Nº1 x1;1672,49;5300;2,00
VELA NUMEROTE BLISTER CON GIBRE FUTBOL BOSTERO Nº2  x1;1672,49;5301;5,00
VELA NUMEROTE BLISTER CON GIBRE FUTBOL BOSTERO Nº3  x1;1672,49;5302;7,00
VELA NUMEROTE BLISTER CON GIBRE FUTBOL BOSTERO Nº4  x1;1672,49;5303;3,00
VELA NUMEROTE BLISTER CON GIBRE FUTBOL BOSTERO Nº5  x1;1672,49;5304;6,00
VELA NUMEROTE BLISTER CON GIBRE FUTBOL BOSTERO Nº6 x1;1672,49;5305;6,00
VELA NUMEROTE BLISTER CON GIBRE FUTBOL BOSTERO Nº7  x1;1672,49;5306;4,00
VELA NUMEROTE BLISTER CON GIBRE FUTBOL BOSTERO Nº8  x1;1672,49;5307;5,00
VELA NUMEROTE BLISTER CON GIBRE FUTBOL BOSTERO Nº9  x1;1672,49;5308;6,00
SERVILLETA COUNTRY LISA DOBLADITAS AMARILLA 33x33 x20u.8;2301,86;5329;17,00
SERVILLETA COUNTRY LISA DOBLADITAS AZUL 33x33 x20u.;2301,86;5330;10,00
SERVILLETA COUNTRY LISA DOBLADITAS CELESTE 33x33 x20u.;2301,86;5331;10,00
SERVILLETA COUNTRY LISA DOBLADITAS NARANJA/SALMON 33x33 x20u.;2301,86;5332;21,00
SERVILLETA COUNTRY LISA DOBLADITAS NEGRA 33x33 x20u.;2301,86;5333;8,00
SERVILLETA COUNTRY LISA DOBLADITAS ROJA 33x33 x20u.;2301,86;5334;0,00
SERVILLETA COUNTRY LISA DOBLADITAS ROSA 33x33 x20u.;2301,86;5335;1,00
SERVILLETA COUNTRY LISA DOBLADITAS VIOLETA 33x33 x20u.;2301,86;5336;26,00
ADORNO PINCHE SET BABY SHOWER CELESTE CALUMI x3u.;2666,84;5340;0,00
BOWL PLASTICO NEGRO PARA CHOCOLATE APTO MICROONDAS x1;6024,76;5363;15,00
VINCHA STRASS DELUXE MOM TO BE (futura mama) x1;12452,72;5375;2,00
GUANTES DE TELA BLANCO CORTO x1 PAR;3421,56;5428;56,00
DISFRAZ OFICIAL ECONOMICO ELSA T2 x1 8223;37217,88;5431;0,00
GUANTES DE ENCAJE BLANCO x1 PARTY STORE AC622/03931;5430,63;5446;0,00
GUANTES DE ENCAJE NEGRO x1 PARTY STORE AC623/03933;5430,63;5447;0,00
SERVILLETA COUNTRY LISA DOBLADITAS VERDE 33x33 x20u.;2301,86;5546;17,00
ANIMALITO GLASE PARA HUEVO CARA CONEJO BLANCO Y CELESTE x6;4342,57;5558;0,00
GALLETITAS CHOCOLINAS x250 grs.(BULTO 25x250grs.)  14323;66714,43;5563;0,24
CAJA MULTIUSO CON VISOR RECTANGULAR CMRV001(25x16x11cm) x25 MEDORO;24077,53;5585;1,60
BARRITA DE CARAMELO CABLE FRUTILLA ACIDA BULL DOG (12un x18gr) x1 378550;5203,95;5588;3,84
SERVILLETA UNICORNIO VINTAGE x20und;2634,51;5617;0,00
CAJA MULTIUSO CUADRADA MEDIANA (25 x25 x10cm) x25 (M21) MEDORO;25995,45;5648;2,16
ADORNO CON BASE FELIZ CUMPLEAÑOS KUROMI Y MELODY x1 u.CREACIONES PAU;4026,53;5652;0,00
ADORNO CON BASE FELIZ CUMPLEAÑOS POKEMON x1 u.CREACIONES PAU;4026,53;5653;1,00
BOCADITO FEL-FORT MARROC x20un 0612;20755,08;5656;1,00
GORRO COWBOY TORNASOLADO CON LUZ x1  DA91A;14807,20;5688;1,00
ANTEOJO CON LUZ MODELOS SURTIDO x12 DA369D;25247,38;5740;1,17
APLIQUE MARIPOSA ESTAMPADA CALADA 3D PARA TORTAS ADHESIVA x12;1094,32;5765;1,00
PIÑATA CARTON MARIPOSAS GLAM CON STAMPING x1 GM 9413;3240,47;5773;2,00
ADORNO CON BASE FELIZ CUMPLEAÑOS MINECRAFTx1 u.CREACIONES PAU;4026,53;5899;0,00
STICKERS EN PLANCHA JURASSIC WORLD (plancha 2 x 12) C.O;1549,91;5913;8,00
TIMER DIGITAL TEMPORIZADOR COLOR x1 B0950;3635,80;5969;0,00
CORTANTE MARCADOR PLASTICO 3D CONTORNO MARIPOSA x1 DESING (26);1070,87;6135;1,00
CORTANTE MARCADOR PLASTICO 3D SET MARIPOSA x4 DESIGN (86-1);2192,11;6138;6,00
LADRILLOS MOGUL EXTREME FRUTILLA x500gr 1014164;10130,72;6190;0,00
ADORNO PINCHE SET FELIZ CUMPLE MARIPOSAS GLAM CALUMI x3u.;2666,84;6253;8,00
ADORNO PINCHE SET FELIZ CUMPLE MINECRAFT CALUMI x3u.;2666,84;6254;2,00
ADORNO PINCHE SET FELIZ CUMPLE STITCH CALUMI x3u.;2666,84;6255;3,00
AFICHE FELICIDADES LA SIRENITA ARIEL  x1;2946,51;6293;1,00
MALVAVISCO MINI GONGYS  MULTICOLOR (BULTO 12x200grs) 78598;35503,87;6295;2,25
LIMPIAPIPA COMUN MULTICOLOR 30CM.X 100 UNIDADES C.B.X.;3554,50;6342;7,14
AZUCAR DEWEY FRACCIONADA TALCO x10 kg;51009,90;10200006;2,80
MARCADOR PARPEN DE HOJAS S5;3409,88;10200007;1,00
NUEZ MARIPOSA xKG.;26832,96;10200013;-1,30
CASTAÑAS DE CAJU P2 xKG;18474,89;10200015;-0,60
GLUCOSA CIOTTI x170grs;2648,12;10200026;2,00
GRANELLA  x1KG;8357,23;10200027;0,00
MANI CROCANTE SIMOAR xkg.;8423,54;10200031;6,20
MOLDE CHARLOTTE ALUMINIO GRANDE 32x11cm x1;20289,03;10200064;2,00
CORNETA FUELLE SIMPLE FLUO Varios colores 40cm;2853,18;10200065;4,00
PULSERA DE GOMA CON BRILLO x10;1800,04;10200079;14,00
MOLDE HOJALATA PAN LACTAL CHICO 26x9x10cm x1;19485,30;10200093;0,00
GLUCOSA CIOTTI x1KG.;8227,26;10200098;1,00
MOLDE HOJALATA REDONDO ALTURA 10 20cm x1;18732,53;10200102;-3,00
DISFRAZ CABALLERO CROSTIx1 04 T1;25727,63;10200108;6,00
ZUNCHOSxkg 70cm;3312,09;10200129;-0,10
TENEDOR BOMBON x2;6323,79;10200131;3,00
GORRO GRANADERO CREEPx6 (LP04);22647,13;10200134;3,34
AROS DE HOJALATA Nº14 516;9588,47;10200138;3,00
AROS DE HOJALATA Nº24 523;12886,75;10200140;2,00
AROS DE HOJALATA Nº26 524;14889,11;10200146;10,00
MANGA TELA N60 x1;3818,84;10200151;5,00
AROS DE HOJALATA Nº16 517;9588,47;10200154;2,00
AROS DE HOJALATA Nº12 515;9588,47;10200156;5,00
AROS DE HOJALATA Nº18 518;10297,52;10200159;3,00
AROS DE HOJALATA Nº20 521;11921,58;10200160;0,00
MOLDE HOJALATA REDONDO ALTURA 10 22cm x1;19820,66;10200180;1,00
MOLDE HOJALATA REDONDO ALTURA 10 26cm x1;25156,70;10200181;-2,00
ARMADOR FLORES PARPEN S1;1953,75;10200222;2,00
SET MARINERO ECHYZOS x1 (boina,pechera);7400,84;10200227;3,00
PONCHO VENDEDOR CROSTIx1 23;10585,08;10200229;14,00
DELANTAL CON PAÑUELO PAISANA CROSTIx1 (25);8085,83;10200231;10,00
DELANTAL CON PAÑUELO NEGRITA CROSTIx1 (25);8085,83;10200234;17,00
PULSERA CON BRILLO  PATRIMAR x36;3092,91;10200235;9,00
DINOSAURIO PATRIMAR x12;5786,12;10200240;0,00
PLACA HOJALATA VAINILLA PARA 12 UNI. 32x25cm. x1;23966,39;10200241;3,00
PIONONERA HOJALATA N4 34x24cm;20446,74;10200242;1,00
PIONONERA HOJALATA N5 38x30cm;22916,01;10200243;2,00
MANGA TELA N50 x1;2836,50;10200248;4,00
BOMBACHA PARA GAUCHO CROSTI 18 T1;8820,90;10200249;3,00
RAVIOLISTO CURVO x48 099;9951,48;10200252;0,00
REJILLA POSA TORTA ALAMBRE 22x28;8064,63;10200255;0,00
MANGA FORRADA CON NYLON N60;6393,16;10200273;5,00
MOLDE ALUMINIO PELOTA CON GAJOS x1;10640,95;10200275;3,00
MOLDE ALUMINIO POLLERA CHICA x1;3688,85;10200277;-2,00
MOLDE ALUMINIO POLLERA GRANDE x1;7977,16;10200278;0,00
PIONONERA HOJALATA N6 42x32cm;26614,91;10200291;1,00
PICO PARA RELLENAR CHURROS 15cm x1;5678,53;10200305;5,00
VASO MEDIDOR CON RELIEVE x1;5164,20;10200317;4,00
MANGA FORRADA CON NYLON N50;5434,18;10200361;4,00
AROS DE HOJALATA Nº22 522;11878,35;10200377;4,00
MATRACA ECONOMICA PATRIMARx12 (Colores surtidos);3735,10;10200378;22,00
MOLDE CHARLOTTE ALUMINIO CHICO 22x11cm x1;13855,39;10200381;2,00
EYECTOR PARPEN (15 DISCOS METAL) MP35;9243,84;10200404;1,00
AVELLANA PELADAS xKG.;41841,80;10200405;0,20
MANGA B.B DESCARTABLE Nº60 x10;4803,32;10200406;27,40
CORNETON FLUO GRANDE Varios colores 33cm;1153,95;10200431;1,00
ROSARIO COMUNION ECONOMICO DENARIO x 10;1626,24;10200444;-1,00
HILO BARRILETE BLANCOx10;2968,61;10200446;6,70
CUCHILLO DENTADO J.J 40cm x1;9680,97;10200449;8,00
PASTAFROLA FIJA HOJALATA Nº22 x1;4073,38;10200455;1,00
BANDA DE REINA x1;4573,80;10200468;6,00
BANDA DE PRINCESA x1;4573,80;10200469;10,00
VINCHA FLUO CON ESTRELLAS x4;2332,64;10200470;0,00
VINCHA FLUO CORAZON CHICA x4;0,00;10200472;0,00
ALMENDRA PELADA xKG;32270,70;10200488;2,20
TROMPITO COLORIDO  PATRIMAR x24;2623,99;10200504;12,00
AZUCAR DEWEY NEGRA x1kg;4681,75;10200524;1,10
CORTANTE NUMEROS AMALIx9;8351,03;10200533;3,00
BICHITOS PATRIMAR x24;4898,21;10200569;0,00
MINI DINOS PATRIMAR x12;2791,26;10200570;3,00
CUCHILLO CORTA TORTA J.J 40cm x1;12664,00;10200585;6,00
MOLDE HOJALATA REDONDO ALTURA 10 24cm x1;21309,06;10200613;0,00
MOLDECITO COLOR  PATRIMAR x36;3513,59;10200630;-1,00
BOLSA PARA CARIOCA GIGANTEx12 (60x90);15444,05;10200646;3,00
COLLAR DE GOMA CON BRILLO x6;2057,19;10200669;68,00
PALITO PARA GLOBO CON CHUPETE BLANCO x100;8228,00;10200686;5,38
COPA NANCY CHAMPAGNE CRISTAL 032 (BULTO x100);49352,57;10200689;0,10
COPA NANCY CHAMPAGNE PIE NEGRO 032 (BULTO x100);49352,57;10200697;2,70
CORTANTE MULTY PASTELITO Nº10 10x10cm x1;3970,56;10200703;-5,00
CORTANTE MULTY PASTELITO Nº8 8x8cm x1;3555,55;10200704;-5,00
ESTABILIZADOR PARA CREMA GHELCOx600grs;18649,65;10200710;1,17
MOLDE HOJALATA PARA PAN DE MIGA Nº2 R.C 30x9x10cm x1;31391,33;10200726;2,00
PONCHO GAUCHO CROSTIx1 23;10585,08;10200728;7,00
JARRA MEDIDORA 1/2 LITRO PLASTICA;5924,16;10200745;1,00
MOLDE HOJALATA PAN LACTAL GRANDE 30x9x10cm x1;27440,80;10200759;2,00
AVIONCITOS PATRIMAR x36;2848,32;10200769;5,00
GORRO EGRESADO ECONOMICOx12 (LP02);17668,60;10200771;4,00
HILO PARA BARRILETE xkg. (4x250gr.);11410,40;10200778;0,75
PONCHO COYA CROSTI 30;13819,41;10200795;0,00
FECULA DE MAIZ DEWEY FRACCIONADA (BULTO x10KG);40059,77;10200802;0,10
AUTO FORMULA 1 STASIO x6 7006;4157,28;10200820;0,00
CORNETIN STASIO CHICO x12 7010;2096,03;10200822;8,00
SILBATO FLUO STASIO x24 7011;2673,52;10200823;0,00
RANITAS SALTARINAS STASIO x12 7083;2361,42;10200842;19,00
ANILLO CON BRILLO STASIO x36 7153;4260,28;10200856;9,00
DIENTE DRACULA BLANCO STASIO x12 7350;1913,96;10200875;15,75
MURCIELAGO GRANDE;8625,73;10200879;6,00
ESQUELETO GRANDE x2 7364;2704,42;10200881;12,00
MOLDE ALUMINIO ROSCA PASCUA LISO 24;8663,67;10200894;2,00
MOÑO RAPIDO GRANDE SURTIDO x50 M102;10074,21;10200915;-0,20
NARIZ PAYASO ROJA CON ELASTICO x36 7994;5842,29;10200924;8,00
HERRAMIENTAS GRANDES STASIO x36 8123;3372,74;10200935;15,00
ANIMALITOS ZOO PATRIMAR x12;1638,57;10200943;13,00
SET CON ACCESORIOS PIRATA x1 (chaleco,espada,pañuelo,parche);19847,03;10200950;0,00
AROS DE HOJALATA Nº8 637;8059,30;10200969;0,00
AROS DE HOJALATA Nº10 636;9066,71;10200970;8,00
MOLDE ALUMINIO ESPECIAL PARA PAN DULCE 18cm x1;11328,85;10200993;0,00
SET CON ACCESORIOS COCINERO x1 (delantal,gorro,palo);15216,05;10201007;2,00
SET CON ACCESORIOS INDIO x1 (chaleco,vincha);12569,78;10201009;0,00
SET CON ACCESORIOS INDIA x1 (chaleco,pollera,vincha);12569,78;10201010;11,00
SET CON ACCESORIOS SOLDADO x1 (boina,chaleco,handy,granada);14554,49;10201011;0,00
VELA FLOR MUSICAL CIEN FUEGOS x1;9263,38;10201013;-14,00
VINCHA FLUO MANITOS x4;2366,94;10201035;3,50
VINCHA FLUO SURTIDAS x4;2554,79;10201036;-1,00
PECHERA GRANADERO PAÑOx1 401;5847,52;10201064;80,00
PECHERA REALISTA PAÑOx1 403;5847,52;10201066;32,00
PECHERA BELGRANO PAÑOx1 405;5689,48;10201067;6,00
PECHERA CABALLERO PAÑOx1 406;5689,48;10201068;33,00
PECHERA SAN MARTIN PAÑOx1 404;5847,52;10201069;20,00
VINCHA FLUO SIMBOLO DE LA PAZ x4;2366,94;10201070;27,75
ESTEKA PARPEN VAINILLA  MULTIUSO x1 EPV;3650,31;10201080;11,00
BANDA PATRIAx1;4573,80;10201085;31,00
RULETERO PARPEN METALICO x1 BMU0;5232,56;10201100;11,00
DISFRAZ PERSONAJE HOMBRE ARACNIDO T2x1 CR;31430,96;10201108;0,00
DISFRAZ PERSONAJE HOMBRE ARACNIDO T3x1 CR;28287,86;10201109;0,00
DISFRAZ NEGRITO ALE T2x1;16237,14;10201152;1,00
BOMBACHA PARA GAUCHO CROSTI 18 T2;8820,90;10201212;2,00
BOMBACHA PARA GAUCHO CROSTI 18 T3;8820,90;10201213;2,00
MARCADOR PARPEN DE COSTURAS MDC;5808,93;10201216;4,00
MANGA B.B DESCARTABLE Nº2 x10;2071,08;10201238;57,70
MANGA B.B DESCARTABLE Nº1 x10;1639,82;10201243;41,00
MANGA B.B DESCARTABLE Nº3 x10;2763,03;10201244;18,20
MANGA B.B DESCARTABLE Nº4 x10;3090,04;10201246;17,90
MANGA B.B DESCARTABLE Nº50 x10;3938,39;10201248;19,40
LAGARTIJAS COLOR  PATRIMAR x36;3984,40;10201254;11,00
CHUPETIN CORAZON GRANDE CARAMELO x20u. HUMPI;18426,79;10201272;0,05
MANGA B.B DESCARTABLE Nº0 x10;1471,57;10201281;0,60
SACO CABALLERO CON YABOT CROSTI 24 T1;17641,80;10201282;0,00
SACO CABALLERO CON YABOT CROSTI 24 T3;17641,80;10201284;0,00
DISFRAZ DAMA ANTIGUA CROSTIx1 03 T4;28520,91;10201393;0,00
GORRO BICORNIO SAN MARTIN TELA ROXx1 P14;5292,61;10201395;21,00
GORRO GRANADERO ROXx1 P16;5292,61;10201400;27,00
PASA DE UVA SIN SEMILLA x1KG;6665,35;10201407;0,20
BUDIN HOJALATA GRANEADO R.C.Nº3 22x11cm (22);13457,64;10201419;-1,00
BUDIN HOJALATA GRANEADO R.C.Nº4 24x11cm (24);16706,44;10201420;0,00
BATUQUE PATRIMAR x12;5763,06;10201450;1,00
CORTANTE HOJAS LISAS PLASTICAS AMALIx4;5432,35;10201462;2,00
GALERA CON CENTRO FLOR MULTICOLOR METAL JLx1 445;12104,24;10201464;0,00
ARAÑAS COLOR PATRIMAR x24;2924,01;10201496;21,00
AZUCAR DEWEY RUBIA x1kg;4681,75;10201498;0,70
FLANERA ALUMINIO LABRADA Nº18  x1;7357,30;10201499;1,00
FLANERA ALUMINIO LABRADA Nº20  x1;7290,67;10201500;0,00
FLANERA ALUMINIO LABRADA Nº22  x1;8435,37;10201501;0,00
FLANERA ALUMINIO LISA Nº18  x1;7050,96;10201502;4,00
FLANERA ALUMINIO LISA Nº20  x1;7631,40;10201503;3,00
FLANERA ALUMINIO LISA Nº22  x1;8168,81;10201504;0,00
SAVARIN ALUMINIO N22  x1;10718,33;10201505;1,00
SAVARIN ALUMINIO N24  x1;11132,37;10201506;1,00
SAVARIN ALUMINIO N26  x1;12161,63;10201507;1,00
SAVARIN ALUMINIO N28  x1;12943,27;10201508;1,00
SAVARIN ALUMINIO N30  x1;14839,28;10201509;1,00
TORTERA ALUMINIO Nº22  x1;9117,90;10201511;0,00
TORTERA ALUMINIO Nº24  x1;9848,79;10201512;0,00
TORTERA ALUMINIO Nº26  x1;10820,87;10201513;0,00
TORTERA ALUMINIO Nº28  x1;11548,12;10201514;0,00
GALERA FLUO DE TELA JERSEY 1006;8774,92;10201518;2,00
VINCHA FLUO HOT x4;2366,94;10201537;3,50
ARANAS NEGRAS PATRIMAR x24;3248,90;10201538;3,00
BANDA DE EGRESADOx1;4827,90;10201570;4,00
TIRA GOMA EVA MI BAUTISMO CELESTE ART.20/60.000;7035,04;10201610;5,00
TIRA GOMA EVA GLOBITOS FELIZ CUMPLE NENE ART.31/70.000;5155,33;10201614;2,00
BILLETE DIDACTICO PESOS x100;2120,28;10201621;0,00
ROSARIO ECONOMICO GRANDE BLANCO x1;4694,07;10201654;-4,00
ROSARIO ECONOMICO GRANDE CRISTAL;4694,07;10201655;-1,00
CINTA BALLOU 03 LISA BLANCA Nº01 x50mts C223;4091,43;10201669;0,00
CINTA BALLOU 03 LISA ROJO Nº08 x50mts C223;4091,43;10201675;0,00
CINTA BALLOU 03 LISA LILA Nº19 x50mts C223;4091,43;10201681;3,00
CINTA BALLOU 03 LISA TURQUESA Nº14 x50mts C223;4091,43;10201684;1,00
VELA BENGALA  DECORADA MILLONARIO x4;3458,12;10201727;3,25
VELA BENGALA  DECORADA BOSTERO x4;3458,12;10201728;0,75
CORTANTE FLORES PLASTICAS MARGARITA/NO ME OLVIDES AMALIx6;6035,96;10201731;5,00
MARACA BANANA GIGANTE x6;7550,40;10201820;8,00
CHALECO DE GAUCHO x1;7448,76;10201864;11,00
POLLERA PAISANA x1;9408,96;10201865;2,00
POLLERA NEGRITA x1;9408,96;10201866;0,00
ROSITAS PORCELANA FRIA BLANCA x6 (PATRICIA);6776,00;10202089;0,00
SOLDADITOS CAMUFLADOS PATRIMAR x12;1634,38;10202178;19,00
BOUQUET ROSAS PORCELANA FRIA BLANCO (PATRICIA);5793,48;10202202;1,00
GORRO REALISTA JERSEY ROXx1 P.22;5292,61;10202300;0,00
SACO CABALLERO CON YABOT CROSTI 24 T4;17641,80;10202627;0,00
ESTEKAS VIOLETA COOPER x 14;10561,34;10202674;2,00
ARANAS GRANDE NEGRA PATRIMAR x6;1544,18;10202686;1,00
PALITO PARA CHUPETIN BLANCO x1/2kg;11757,72;10202729;12,80
MOLDECITO COLOR GRANDE x24;2678,61;10202917;9,00
ROSARIO COMUNION PERLAS CRUZ ACRILICO DENARIO x4 BLANCO;3225,38;10202961;0,00
CORTANTE REDONDO LISO Nº10 10cm x2;4419,28;10203010;4,00
CORTANTE REDONDO LISO Nº11 11cm x2;5020,81;10203011;4,50
CORTANTE REDONDO LISO Nº12 12cm x2;5240,13;10203012;2,00
CORTANTE REDONDO LISO Nº13 13cm x2;5840,96;10203013;3,00
CORTANTE REDONDO LISO Nº14 14cm x2;6372,04;10203014;0,50
CORTANTE REDONDO LISO Nº15 15cm x2;6107,99;10203015;-0,50
CORTANTE REDONDO LISO Nº3 3cm x6;6580,61;10203016;3,97
CORTANTE REDONDO LISO Nº4 4cm x6;7342,84;10203017;2,33
CORTANTE REDONDO LISO Nº5 5cm x6;8848,74;10203018;0,50
CORTANTE REDONDO LISO Nº6 6cm x6;11486,46;10203019;3,84
CORTANTE REDONDO LISO Nº7 7cm x4;7567,55;10203020;3,75
CORTANTE REDONDO LISO Nº8 8cm x4;7972,63;10203021;3,50
CORTANTE REDONDO LISO Nº9 9cm x4;8070,00;10203022;0,50
CORTANTE REDONDO LISO Nº2 2cm x6;7743,47;10203023;3,00
TERMOMETRO REPOSTERO HASTA 150ºC x1;7635,58;10203029;11,00
CUBANITO MARROC OBLITA x48 (BULTO x16) 1615;81621,55;10203032;1,00
MOÑO ROSETA ESPECIAL PERLADO x6 M315;7597,64;10203036;-2,50
MOÑO ROSETA ESPECIAL FANTASIA x6 M314;5724,18;10203038;-0,16
BANDERA ARGENTINA TELA CON SOLx1 (70 x140);6455,59;10203151;2,00
MARACA CHOCLO FLUO x50 (Colores surtidos);22101,98;10203211;1,32
MARACA BANANA FLUO x50 (Colores Surtidos);22101,98;10203212;0,24
MARACA FLUO x250;90146,49;10203256;2,74
MARACA FLUO x50;22101,98;10203257;-3,20
ALIANZA METAL PREMIUM ORO x25;8306,35;10203266;2,00
CINTA RASO Nº1 BLANCA x10mts 1;3011,98;10203315;0,80
CINTA RASO Nº1 ROSA x10mts 12;3011,98;10203321;1,00
CINTA RASO Nº1 AZUL x10mts 14;3011,98;10203323;3,80
CINTA RASO Nº1 SALMON x10mts 27;3011,98;10203329;1,00
CINTA RASO Nº1 MANZANA x10mts 32;3011,98;10203330;1,00
CINTA RASO Nº2 CELESTE x10mts 3;3552,78;10203332;1,00
CINTA RASO Nº2 NEGRO x10mts 16;3552,78;10203340;5,00
CINTA RASO Nº5 CELESTE x10mts 3;6015,16;10203370;6,00
CINTA RASO Nº5 AMARILLO x10mts 4;6015,16;10203371;11,00
CINTA RASO Nº5 LILA x10mts 6;6015,16;10203372;3,00
CINTA RASO Nº5 ROJO x10mts 8;6015,16;10203373;2,00
CINTA RASO Nº5 VERDE AGUA x10mts 13;6015,16;10203376;6,00
CINTA RASO Nº5 AZUL x10mts 14;6015,16;10203377;3,00
CINTA RASO Nº5 ORO x10mts 17;6015,16;10203379;10,00
CINTA RASO Nº5 TURQUEZA x10mts 18;6015,16;10203380;3,00
CINTA RASO Nº5 VERDE x10mts 20;6015,16;10203381;4,00
CINTA RASO Nº5 MANZANA x10mts 32;5296,98;10203384;0,00
CINTA RASO Nº5 NARANJA x10mts 19;6015,16;10203553;5,00
AGITADOR DE CAFE BLANCO/CRISTAL 10,5cm x1000 aprox.;5978,01;10203571;0,00
AZUCAR DEWEY FRACCIONADA RUBIA (BULTO x10KG.);39502,28;10203594;0,00
BOLSAS DE PAPEL x100 (art.1);3187,21;10203647;7,30
BOLSAS DE PAPEL x100 (2L);3442,94;10203648;23,60
BOLSAS DE PAPEL x100 (4A);4977,69;10203649;24,20
MANGA PARPEN DESCARTABLE 45cm. ROLLOx50uni. MD18R5;31394,56;10203653;0,00
VASO AMERICAN PLAST 1000cc x50;13608,07;10203656;0,00
VELA BENGALA  DECORADA ACADEMIA x4;4054,35;10203863;0,00
VELA BENGALA  DECORADA CUERVO x4;3458,12;10203864;0,25
PIROTIN CUPCAKES Nº10 LISO PL9 ROJO x510 M-PACK;18547,87;10203958;0,24
ABECEDARIO GOMA EVA MEDIANO x45 ;6872,80;10203960;26,00
PIROTIN CUPCAKES Nº10 LISO  PL11 AZUL x510 M-PACK;18547,87;10203962;0,35
PIROTIN CUPCAKES Nº10 LISO PL2 NEGRO x510 M-PACK;18547,87;10203963;0,00
BOINA GAUCHO CROSTIx4 (17);14578,99;10203989;11,00
VELA BENGALA  DECORADA H.ARAÑAx4;3458,12;10203994;2,25
GORRO BICORNIO BELGRANO TELA ROXx1 P15;5292,61;10203996;12,00
PIROTIN CUPCAKES Nº10 METALIZADO DORADO PM1 x200 M-PACK;26727,79;10204110;1,50
PIROTIN CUPCAKES Nº10 METALIZADO PLATA PM2 x200 M-PACK;26727,79;10204118;0,90
PIROTIN CUPCAKES Nº8 LISO PL 10 ROSA x510 M-PACK;14371,21;10204161;-0,56
MINIATURA SURTIDO FONDO DEL MAR STASIO x24;4407,23;10204163;9,00
CINTA RASO Nº1 AMARILLO FLUO x10mts 37;2260,90;10204191;-1,00
CINTA RASO Nº1 NARANJA FLUO x10mts 39;2260,90;10204193;0,00
DISFRAZ PERSONAJE HOMBRE ARACNIDO T0x1 CR;31430,96;10204203;0,00
ESENCIA FLEIBOR VAINILLA 110cc x12 uni.;22750,90;10204265;1,26
GALERA HEXAGONAL FLUO FLOR MULTICOLOR JL x1 430/451;12120,57;10204306;0,00
MOÑO MEDIANO METAL SURTIDOx12 M014;9332,13;10204332;10,75
GALERA MOÑO FLUO LISA;13950,09;10204339;2,00
ESTEKAS CUCHILLO PLASTICA x4;2998,38;10204375;0,00
DISFRAZ DAMA ANTIGUA DELUXE CROSTI x1 T2;48367,94;10204521;1,00
VASO 180cc NEGRO x100;6589,47;10204550;8,80
MANGA PARPEN DESCARTABLE 30cm. ROLLOx50uni. MD12R5;18761,22;10204563;0,00
DISFRAZ DAMA ANTIGUA DELUXE CROSTI x1 T3;48367,94;10204588;0,00
PLATO CHICO AMARILLO x50 BAND.PLAST;7851,70;10204648;2,00
PLATO CHICO AZUL x50 BAND.PLAST;7851,70;10204649;6,00
PLATO CHICO CELESTE x50 BAND.PLAST;7851,70;10204650;0,00
PLATO CHICO NEGRO x50 BAND.PLAST;7851,70;10204651;-1,00
PLATO CHICO VERDE x50 BAND.PLAST;8342,43;10204654;6,80
BOLSON MOÑOS FLUO x5;8673,97;10204803;11,00
SET HALLOWEEN MARTES 13x1  ECHYZOS;13772,37;10204815;2,00
GUIRNALDA HALLOWEEN CALABAZA GRANDE NARANJA x3;8842,68;10204902;4,67
GUIRNALDA HALLOWEEN FANTASMA GRANDE x3;8110,87;10204903;11,00
UÑAS DE BRUJA PLASTICAS NEGRAS 927x 10;2322,84;10204961;3,00
BOLSON CORBATA CON ESTRELLAS FLUO x 5;14162,59;10205068;-0,80
BOLSON MOÑOS PAYASO ESTRELLA CHICO FLUO x 5;9997,11;10205075;0,00
SET CON ACCESORIOS ESPECIAL MAGO x1 ECHYZOS;10367,28;10205141;8,00
MECHITAS DE PELO MULTICOLOR x5;5553,90;10205299;7,00
CORTA TORTA DE ACERO J.J x1;7321,40;10205300;5,00
DISFRAZ DAMA ANTIGUA CON MITON/MANTILLA/MIRIÑAQUE CROSTI x1 T2;32702,67;10205331;0,00
ACCESORIO VINCHA CANASTA CON EMPANADAS x1;8470,00;10205341;10,00
ACCESORIO CANASTA CON PASTELITOS x1;7623,00;10205342;2,00
CAPA NIÑO HALLOWEEN CON CAPUCHA NEGRA  x1 CROSTI;7497,77;10205352;0,00
TUNICA ADULTO/ADOLESCENTE SANGRIENTA x1 CROSTI;16402,31;10205430;0,00
TROFEO COPA DEL MUNDO ORO METAL (PLASTICA);13806,65;10205509;0,00
PLACA D.E.L. P/CHUPETIN Nº108 x5 CORAZON GRANDE;6234,25;10205521;4,60
CAPA NIÑO HALLOWEEN DRACULA CON YABOT CROSTI x1;19111,95;10205532;0,00
SET HALLOWEEN JUEGO DEL MIEDO x1 ECHYZOS;12107,34;10205687;2,00
DISFRAZ BRUJA MONSTER CON TULL CROSTI x1 T1;29991,06;10205690;1,00
DISFRAZ HALLOWEEN BRUJA MONSTER CON TULL CROSTI x1 T3;22493,30;10205691;-4,00
GALERON METAL VERTICAL MILLONARIO JLx1;16171,65;10205891;2,00
GALERA CUADROS MILLONARIO JERSEYx1 1105;10079,30;10206011;2,00
FRUTA ESCURRIDA ORIETA x10kg.;42942,90;10206021;0,00
BANDEJA MICROONDAS Nº 103 RECT.STANDARDx100 BAND P;19605,34;10206094;0,00
CUCHILLO BLANCO REFORZADO x100 FF204B;5038,63;10206156;10,00
TENEDOR BLANCO REFORZADO x100;0,00;10206158;20,00
GALERA CUADROS MILLONARIO JERSEY ROX 254;8690,22;10206195;1,00
GALERA CUADROS BOSTERO JERSEY ROX 254;8232,84;10206197;2,00
GUIRNALDA PATRIA REDONDA GRANDE  x4  68;9825,20;10206222;2,50
JUGADORES CON ARCO BOSTEROS x5 M;7107,36;10206244;9,00
JUGADORES CON ARCO MILLONARIOS x5 M;7107,36;10206245;11,00
VINCHA FLUO MARGARITA x4;0,00;10206510;0,00
FALSA TORTA TELGOPOR RECTANGULAR 30x35 Y 20x25 x2;8281,85;10206553;0,00
JUEGO DE CORTANTES REDONDO PLASTICOx10;5212,68;10206554;10,00
BOLSITAS POLIPROPILENO x200 (8x30);5233,73;10206737;11,55
GALERA HEXAGONAL HOLOGRAFICO COLOR JL x1 457;12087,90;10206772;3,00
ADORNO TORTA BASE GIBREADA CAMISETA BOSTEROS x1;2564,72;10206851;2,00
MOLDE DE SILICONA PUNTILLA Nº5 x1 MAMA DORA;6800,08;10206885;5,00
MOLDE DE SILICONA PUNTILLA Nº2 x1 MAMA DORA;6594,02;10206886;1,00
MOLDE DE SILICONA PUNTILLA Nº8 x1 MAMA DORA;6594,02;10206894;3,00
TARTA HOJALATA FIJA Nº3 x1 26cm RC;8147,57;10206969;5,00
PASTAFROLA FIJA HOJALATA Nº2 26cm x1 R.C;8626,84;10206970;2,00
TARTA HOJALATA FIJA Nº4 x1 28cm RC;9305,56;10206971;5,00
PASTAFROLA FIJA HOJALATA Nº3 28cm x1 R.C;9608,90;10206972;20,00
TARTA HOJALATA FIJA Nº5 x1 30cm RC;9741,54;10206973;5,00
PLACA D.E.L. P/ HACER BOMBONES CHOCO FRASES x4;6269,37;10207354;1,00
MOÑO PARA AUTO DECORATIVO x1 AZUL;25286,58;10207768;0,00
MOÑO PARA AUTO DECORATIVO x1 BLANCO;25286,58;10207770;1,00
MOÑO PARA AUTO DECORATIVO x1 FUCSIA;25286,58;10207771;1,00
MOÑO PARA AUTO DECORATIVO x1 LILA;25286,58;10207772;0,00
MOÑO PARA AUTO DECORATIVO x1 ORO;25286,58;10207773;0,00
MOÑO PARA AUTO DECORATIVO x1 PLATA;25286,58;10207774;0,00
MOÑO PARA AUTO DECORATIVO x1 ROJO;25286,58;10207775;0,00
MOÑO PARA AUTO DECORATIVO x1 ROSA;25286,58;10207776;2,00
MOÑO PARA AUTO DECORATIVO x1 SALMON;25286,58;10207777;0,00
MOÑO PARA AUTO DECORATIVO x1 TURQUEZA;25286,58;10207778;0,00
MOÑO PARA AUTO DECORATIVO x1 VERDE AGUA;25286,58;10207779;0,00
MOÑO PARA AUTO DECORATIVO x1 VIOLETA;25286,58;10207780;0,00
DISFRAZ BRUJA GALA CROSTIx1 T2;27050,76;10207889;-4,00
DISFRAZ DRACULA NIÑA CROSTIx1 T1;21553,13;10207958;-1,00
DISFRAZ HALLOWEEN BRUJA CON TULL CROSTIx1 T3;25433,60;10207966;-1,00
GALERA METAL COLOR LUJO;14025,23;10208103;0,00
GALERON TRIANGULOS METAL;18139,20;10208174;0,00
CHUPETE MINI CRISTAL ROSA x36;3302,21;10208194;3,00
VINCHA FLUO LOVE x4;2366,94;10208223;0,25
PELOTITAS DE TELGOPOR PARA DECORACION X1 BLANCA;2607,07;10208633;9,00
PECHERA CABALLERO CON YABOT DELUXE  x1;6795,36;10208935;0,00
SET DE LAVANDERA  x1;8820,90;10208936;15,00
CORTANTE MARCADOR PLASTICO HOMBRE ARAÑA DESIGN x1 4878;2029,27;10209085;5,00
CORTANTE MARCADOR PLASTICO CUERPO UNICORNIO  DESIGN x1 7627;2029,27;10209087;8,00
CORTANTE MARCADOR PLASTICO ARCO IRIS DESIGN x1 1212;2029,27;10209088;12,00
CORTANTE MARCADOR PLASTICO CAPITONE DESIGN x1;3221,65;10209094;8,00
PICO GLOBO PARPEN x1 BRG204;3078,67;10209189;0,00
