Descripcion;Precio_Venta_Final;IdArticulo;Stock
MANTEL LA SIRENITA ARIEL (1.20x1.80) x1 C.O;8664,08;10241908;3,00
PLATO CUADRADO MULTICOLOR PASTEL (18x18) x8u. C.O;2471,68;10242000;7,00
PLATO CARTON VERDE MANZANA x10 GM 3346-8;1997,20;10242135;2,00
BANDERIN MI BAUTISMO PASTEL CELESTE STAMPING x1 3348/30 GM;2874,76;10242174;4,00
BANDEJA CARTON PIONONO PLATEADA PREMIUN (19.7x34.5cm) x10u.;7120,24;10242342;5,20
CUCHARA DE MADERA C.B.X (14 cm) x50;5481,86;10242494;7,00
JUEGO DE CORTANTES PLASTICOS x 6 U;3291,20;10242502;44,01
BASE EXHIBIDORA PARA GLOBO CON PALITOS x1 52584;3151,35;10242505;0,00
GLACE LISTO PARA DECORAR LAPIZ  BLANCO;3395,16;10242516;0,00
FLOR DE AZUCAR MULTICOLOR PASTEL CON PERLA PLATEADA X 30 UNID.;3659,04;10242532;3,00
PLACA PARA BOMBONES PROFESIONAL BLANCA N1846;3606,77;10242568;6,00
RASQUETA PLASTICA LA BOTICA x1 (CORNET);2950,71;10242577;19,00
CHOCOLATE MAPSACUBER BLANCO X 500 GR;8426,79;10242578;7,50
CHOCOLATE MAPSACUBER LECHE X 500 GR;8426,79;10242590;28,50
CHOCOLATE MAPSACUBER SEMIAMARGO X 500 GR;8426,79;10242591;15,00
ZUNCHOSxkg 70cm x U;94,63;10242598;-5,00
COLORANTE EN POLVO DORADO FLEIBOR;6247,18;10242652;9,00
COLORANTE EN POLVO BLANCO PERLADO FLEIBOR;4423,78;10242653;4,00
PALITO PARA GLOBO CON CHUPETE STASIO CRISTAL 70 cm;1182,97;10242656;-27,00
MANGA DE SILICONA 14" x1 RP5192;1815,04;10242663;8,00
SET PLACA PARA CHUPETIN NUMEROS PARPEN x2  SP1N;8797,83;10242679;0,00
BOCADITO DOS CORAZONES FEL-FORT;1670,49;10242681;40,00
ACUARELAS AL AGUA CON PINCEL X12 UNIDADES C.B.X.;1434,34;10242730;28,00
CINTA DOBLE FAZ ADHESIVA 12MM X 10MTS;1266,29;10242732;0,00
CINTA DOBLE FAZ ADHESIVA 18MM X 10 MTS. C.B.X. PACKING LILA;1634,81;10242733;0,00
BANDERIN FELIZ CUMPLEAÑOS ARCO IRIS CON NUBE STAMPING x1 03348-54 GM;3402,67;10242736;1,00
BANDEJA GIRATORIA PLASTICA GIRAPARPEN PLUS;66654,75;10242741;2,00
BANDERIN 1ª AÑITO ROSA CON STAMPING x1 03348-56 GM;2723,46;10242749;3,00
PLACA HUEVO FyF NUMERO 10 110 GRAMOS;747,06;10242751;46,00
PLACA  PROFESIONAL PELOTA DE FUTBOL BLANCA LINEA GAUDI;944,16;10242795;0,00
SET PLACA MINI HUEVITOS x2 PARPEN  SPMH;9184,29;10242801;0,00
PLACA PARA CHUPETIN REDONDA MICKEY x2u. C.O;4536,67;10242831;0,00
PLACA PARA CHUPETIN REDONDA MINNIE x2u. C.O;2268,33;10242833;-1,00
PLACA PARA CHUPETIN PALETA HOMBRE ARAÑA x2u. C.O;8545,66;10242835;1,00
PLACA PARA CHUPETIN PALETA FROZEN x2u. C.O;9576,47;10242836;1,00
BANDERIN ME RECIBI NEGRO CON STAMPING;2723,46;10242906;11,00
BANDEJA CARTON RECTANGULAR ORO x1 Nº5 33X40;1965,54;10242913;0,00
BANDEJA CARTON RECTANGULAR PLATEADA PREMIUN Nº6 (38x47cm);2361,56;10242915;0,00
BANDEJA CARTON PIONONO PLATEADA PREMIUN (19.7x34.5cm) ;915,46;10242916;52,00
BANDEJA CARTON REDONDA DORADA PREMIUN Nº1 (17cm);432,62;10242917;-4,00
PLACA HUEVO FyF NUMERO 20 500 GRAMOS;775,91;10242924;9,00
PLACA HUEVO FyF NUMERO 15 300 GRAMOS;747,06;10242925;0,00
PLACA HUEVO FyF NUMERO 12 200 GRAMOS;747,06;10242926;269,00
PLACA HUEVO FyF NUMERO 9 100 GRAMOS;747,06;10242927;125,00
PLACA HUEVO FyF NUMERO NUMERO 8 70 GRAMOS;747,06;10242928;174,00
PLACA HUEVO FyF NUMERO 7 45 GRAMOS;747,06;10242929;19,00
PLACA HUEVO FyF NUMERO 6 30 GRAMOS;747,06;10242930;97,00
PLACA HUEVO FyF NUMERO 5 25 GRAMOS;747,06;10242931;15,00
GLACE LISTO PARA DECORAR LAPIZ  NARANJA;3395,16;10242933;2,00
GLACE LISTO PARA DECORAR LAPIZ  AZUL;3395,16;10242934;0,00
GLACE LISTO PARA DECORAR LAPIZ  AMARILLO ;3395,16;10242935;5,00
GLACE LISTO PARA DECORAR LAPIZ  ROJO ;3395,16;10242936;11,00
GLACE LISTO PARA DECORAR LAPIZ  VERDE;3395,16;10242937;4,00
PLACA PARA CHUPETIN CONEJO OREJON Nº2602;999,70;10242940;-2,00
PLACA FIGURA CONEJO SOBRE HUEVO 2214;1396,64;10242941;32,00
PLACA FIGURA GALLINA CHICA CON CANASTA 1494;1176,12;10242943;7,00
PLACA PARA SOUVENIR CUCHARITAS;741,80;10242944;33,00
PLACA PARA SOUVENIR ANIMALES SURTIDOS Nº1650;1234,20;10242947;2,00
PLACA PARA BOMBON CHOCOFRASE FELIZ DIA Nº1543 ;1007,69;10242948;4,40
PLACA PARA SOUVENIR ANIMALITOS Nº1724;1239,83;10242949;1,00
PLACA PARA SOUVENIR ANIMALES GRANJA Nº1200 ;638,70;10242950;15,00
GLOBO METALIZADO MARCO DE SELFIE 34" ROSA GOLD x1 59477;3375,64;10242955;10,00
GLOBO METALIZADO MARCO DE SELFIE 34" RAINBOW x1 59491;3375,64;10242956;3,00
SET PLACA CONEJO DIAMANTE PARPEN x2 SPCD10;9912,38;10242973;4,00
SET PLACA CARA SPIDERMAN Nº10 x2 PARPEN SPS10;6194,56;10242975;3,00
SET PLACA PARA HUEVO CANDY PLANO PARA RELLENAR  Nº15 x2 PARPEN SPH15P;11778,63;10242977;0,00
CAJA PARA MEDIO HUEVO RELLENO N°10 C/BASE P/BOMBONES TAPA PVC;1308,20;10242986;0,00
PLACA PARA CHUPETIN PAREJA DE CONEJOS Nº1602;525,58;10242990;0,00
PLACA PARA HUEVO HOMBRE MICKEY N°10 x2u. C.O;4693,05;10243020;1,00
PLACA PARA HUEVO HOMBRE ARAÑA N°10 x2u. C.O;7300,29;10243022;6,00
CHOCOLATIN MISKY CON LECHE ARCOR x20un. 13095;8234,20;10243061;6,00
PLACA FIGURA ZANAHORIAS 2647 ;1176,12;10243078;5,00
PLACA PARA CHUPETIN CONEJOS OREJA CAIDA;1838,91;10243082;3,00
PLACA FIGURA ECONOMICA LIEBRE P5;914,16;10243084;7,00
PLACA FIGURA CONEJO FELIZ N1659 A ;1070,76;10243085;26,00
PLACA FIGURA CONEJO CON ACORDEON 2213;1117,31;10243086;15,00
PLACA FIGURA CONEJITO Nº1375 A;1014,40;10243087;0,00
GLOBO OVNI METALIZADO ROSA GOLD N0 86 CM;3805,50;10243089;7,00
GLOBO OVNI METALIZADO ROSA GOLD N1 86 CM;3805,50;10243090;19,00
GLOBO OVNI METALIZADO ROSA GOLD N2 86 CM;3805,50;10243091;8,00
GLOBO OVNI METALIZADO ROSA GOLD N3 86 CM;3805,50;10243092;12,00
GLOBO OVNI METALIZADO ROSA GOLD N4 86 CM;3805,50;10243093;12,00
GLOBO OVNI METALIZADO ROSA GOLD N5 86 CM;3805,50;10243094;8,00
GLOBO OVNI METALIZADO ROSA GOLD N6 86 CM;3805,50;10243095;10,00
GLOBO OVNI METALIZADO ROSA GOLD N7 86 CM;3805,50;10243096;7,00
GLOBO OVNI METALIZADO ROSA GOLD N8 86 CM;3805,50;10243099;10,00
GLOBO OVNI METALIZADO ROSA GOLD N9 86 CM;3805,50;10243100;14,00
PLACA PARA BOMBON ECONOMICA CUADRADOS SURTIDO NºB111;888,37;10243138;-3,00
PLACA PARA CHUPETIN CONEJO CON ZANAHORIA N2631;673,82;10243139;-3,00
PLACA ALAJERO/BOMBONERA ROSA  N°2487;1006,24;10243141;3,00
PLACA PARA SOUVENIR JUEGO DE TE/CAFE Nº1388;965,77;10243143;3,60
PLACA PARA SOUVENIR GLOBOS AEROSTATICOS;1131,34;10243144;10,00
PIROTIN CUPCAKE Nº10 COLORES PASTELES SURTIDO  PIR5009;933,58;10243238;5,03
PIROTIN CUPCAKE Nº10 GRANJA;1405,51;10243239;9,00
PREMEZCLA PARA GALLETAS GINGER  x500grs. (con azucar mascabo);7786,35;10243241;0,00
VASO POLIPAPEL AZUL CON ESTAMPING 240cc x8U  ;1937,40;10243262;1,00
GOMITAS MOGUL FRUTALES 35g 6020;954,67;10243284;92,06
COLORANTE EN POLVO LIPOSOLUBLE AMARILLO KING DUST;2989,59;10243286;6,00
COLORANTE EN POLVO LIPOSOLUBLE MARRON KING DUST;2637,88;10243287;-1,00
COLORANTE EN POLVO LIPOSOLUBLE NEON ROSA KING DUST;3523,19;10243293;0,00
COLORANTE EN POLVO LIPOSOLUBLE LIMON KING DUST;2637,88;10243297;0,00
COLORANTE EN POLVO LIPOSOLUBLE CELESTE KING DUST;3165,45;10243298;0,00
COLORANTE EN POLVO LIPOSOLUBLE ROSA CLARO KING DUST;2813,73;10243299;0,00
COLORANTE EN POLVO LIPOSOLUBLE BLANCO KING DUST;2989,59;10243302;10,00
COLORANTE EN POLVO LIPOSOLUBLE FUCSIA KING DUST;2637,88;10243303;2,00
COLORANTE EN POLVO LIPOSOLUBLE NARANJA KING DUST;2637,88;10243304;-1,00
COLORANTE EN POLVO LIPOSOLUBLE AZUL KING DUST;2813,73;10243308;0,00
COLORANTE EN POLVO LIPOSOLUBLE ROJO KING DUST;2989,59;10243309;0,00
PLACA  PROFESIONAL OSO BLANCA LINEA GAUDI N1849;3614,28;10243316;3,00
BOMBONES Y CHOCOLATES SURTIDOS ARCOR x246grs. 1013137;13996,57;10243322;5,00
BOMBON SELECCION DE BOMBONES ARCOR x228grs. 1013138;12876,21;10243323;4,00
MERENGUE URQUIZA SUPER MINI ROSA X 100 GR;1929,28;10243326;7,00
MERENGUE URQUIZA SUPER MINI CELESTE X 100 GR;1759,05;10243327;12,00
LIQUIDO SELLADOR PARA GLOBO GFLOAT x1 100ml ( ALTA DURACION ) 52591;6534,56;10243331;1,00
JUGO DE NARANJA ARCOR (BULTO 24unid x200ml);0,00;10243350;0,00
JUGO DE MULTIFRUTAS ARCOR (BULTO 24unid x200ml);0,00;10243351;0,00
JUGO DE MANZANA ARCOR (BULTO 24unid x200ml);0,00;10243352;0,00
SET PLACA CARA SPIDERMAN Nº15 x2 PARPEN  SPS15;10091,69;10243357;4,00
PLACA PARA SOUVENIRS CAJA DE HERRAMIENTAS N1640;582,02;10243361;3,00
PLACA PARA SOUVENIR CARTAS DE POKER Nº1645;1051,18;10243362;12,00
CACAO AMARGO COLONIAL 701 x kg 062-70163;56243,24;10243394;12,00
CHOCOLATIN MISKY BLANCO ARCOR x20un. 13094;8234,20;10243398;1,00
PLACA PARA CHUPETIN 3 CONEJITOS Nº2390;940,90;10243459;1,00
PLACA PARA CHUPETIN CONEJITOS CAMINANDO Nº1776;573,36;10243460;0,00
VASO POLIPAPEL KRAFT LUNARES CON STAMPING 240 cc x8 ROMI PACK;1529,13;10243494;-3,00
PASTA DE GOMA COLOR ROJA BALLINA X 500 GR;6736,48;10243500;1,00
TIRA GOMA EVA C/BRILLO NENE O NENA ???  x1;5602,66;10243529;8,00
BOCADITO MARROC FEL-FORT;936,48;10243560;52,61
BOCADITO CABSHA;700,70;10243561;39,00
DISCO DE CARTON PREMIUN RECTANGULAR PARA LINGOTE DORADO (14x6cm) x10;2561,85;10243586;19,00
ADORNO SET 3D MI COMUNION x1 UPALALA;2744,28;10243592;0,00
BANDERIN TRIANGULAR METAL ROSA GOLD x1  71709;1849,95;10243611;1,00
BANDERIN TRIANGULAR METAL DORADO 71716;1849,95;10243612;9,00
BANDERIN TRIANGULAR GLITTER ROSA GOLD 71778;1901,61;10243618;-1,00
CHUPETIN BOLITA MISTER POPS x 5;1206,31;10243650;513,48
CARAMELO MASTICABLE PICO DULCE LHERITIER x 100 gr;1457,23;10243651;5,62
BLISTER CORTANTE PLASTICOS NUMEROS/SIGNOS x15u.;6576,42;10243707;5,00
PALO DE AMASAR GIRATORIO MARMOL (48cm aprox.) x1 N878329W;39308,14;10243719;2,00
BANDERIN MI 1ª AÑITO CELESTE CON STAMPING x1  03348-55 GM;2572,16;10243791;0,00
CORTANTE MARCADOR PLASTICO SET HUELLA Y HUESO  x1 DESIGN;2557,50;10243800;4,00
ESTUCHE PORTA CUPCAKES 6 unidades;1473,07;10243845;21,00
PIROTIN CUPCAKE Nº10 CUPCAKE FELIZ DIA;695,37;10243855;7,01
BANDEJA HORNAL R3/F75 x25;5248,38;10243856;1,72
AEROGRAFO MANUAL  x1 BNB23244;14213,30;10243945;0,00
SERVILLETA DECOUPAGE GUARDA FLORES Y MARIPOSAS x20u. 326710;2952,87;10244012;1,00
MOLDE TORTERA ALUMINIO INDIVIDUAL ALT.3 cm. Nº12 MULTY x1;6492,45;10244027;0,00
MOLDE TORTERA ALUMINIO INDIVIDUAL ALT.3 cm. Nº14 MULTY x1;6842,73;10244028;2,00
MOLDE TORTERA ALUMINIO INDIVIDUAL ALT.3 cm. Nº16 MULTY x1;7364,02;10244029;2,00
PLACA  PROFESIONAL BOTELLA DOBLE BLANCA LINEA GAUDI x1 N°1611H;3158,10;10244036;7,00
GALERA PATRIA NIÑO CINTA ARGENTINA x1;1354,72;10244053;8,00
RELLENO BON O BON X 290 GRS;7315,03;10244105;1,00
CAJA MULTIUSO C/VISOR DRIP CAKE 20 (20x20x20cm);3976,99;10244107;0,00
BOINA GAUCHO CROSTI;4373,70;10244122;44,00
DISFRAZ OFICIAL PEPPA ESPECIAL T1x1 1338;43818,96;10244156;2,00
DISFRAZ OFICIAL PEPPA ESPECIAL T2x1 1339;32670,00;10244157;2,00
CUCHARA POSTRE KV x 10 u;825,77;10244161;201,00
TENEDOR BLANCO REFORZADO x 10;700,49;10244162;145,00
CUCHARA CAFE x 10;540,95;10244163;109,55
CUCHILLO BLANCO REFORZADO x 10;576,50;10244164;61,00
PLATO CHICO AMARILLO x 10;1962,92;10244165;20,00
CREMOR TARTARO ALZOL x 100 gr ;2824,65;10244166;39,00
VASO TRAGO LARGO FLEXIBLE PP CELESTE PASTEL x10u.;3245,12;10244208;0,00
VASO TRAGO LARGO FLEXIBLE PP ROSA PASTEL x10u.;3245,12;10244209;27,01
VASO TRAGO LARGO FLEXIBLE PP VERDE PASTEL x10u.;3245,12;10244210;27,00
PIÑATA CARTON PRINCESA x1 C.O;5645,57;10244224;4,00
BANDERIN PRINCESAS x1 C.O;3359,78;10244225;5,00
AFICHE FELIZ CUMPLE PRINCESAS x1 C.O;2946,51;10244227;5,00
MANTEL PRINCESAS (1.20x1.80) x1 C.O;8664,08;10244229;4,00
SET PLACA PARA BIG CANDY Y BARRAS DRIP PARPEN x2 SPBC;3875,76;10244237;0,00
BANDERIN BIENVENIDOS BLANCO CON STAMPING 3348-61-3x1 GM;2724,20;10244238;0,00
BANDERIN BIENVENIDOS NEGRO CON STAMPING 3348-61-3x1 GM;2875,54;10244239;8,00
PIÑATA CARTON ARCO IRIS x1 GM 9463;2851,61;10244247;4,00
BLANQUEADOR DE GLACE / ACIDO ACETICO;2494,75;10244249;0,00
PLATO BLONDA P.A 36cm;3199,89;10244250;-21,00
PLATO BLONDA P.A 27cm;1371,57;10244252;12,00
PLATO BLONDA P.A 24cm;1044,96;10244253;-9,67
PIÑATA GLOBO GIGANTE LISA AMARILLA 36";3258,29;10244257;2,00
COLORANTE LIQUIDO FLEIBOR ROJO;2107,41;10244258;4,00
ISOMALTA ALZOL  x 100;4636,42;10244266;-9,00
CHOCOLATE COLONIAL COBERTURA LECHE x 200 gr;7718,87;10244274;5,00
CHOCOLATE COBERTURA COLONIAL BLANCO x 200 gr;7675,99;10244275;-4,00
BRILLANTINA COMESTIBLE FINO DORADA;446,10;10244276;-13,00
COLORANTE EN POLVO FLEIBOR BRONCE;3822,53;10244280;0,00
COLORANTE EN POLVO FLEIBOR COBRE;3822,53;10244281;1,00
COLORANTE EN POLVO FLEIBOR ROSA GOLD;6247,18;10244282;4,00
MOLDE TORTERA ALUMINIO INDIVIDUAL ALT.3 cm. Nº18 MULTY x1;7817,40;10244285;6,00
MOLDE TORTERA ALUMINIO INDIVIDUAL ALT.3 cm. Nº20 MULTY x1;8722,63;10244286;8,00
BAÑO AGUILA SACHET ROSA SABOR FRUTILLA x6 1013435;24628,49;10244300;0,51
VASO TRAGO LARGO FLEXIBLE PP AMARILLO PASTEL x10u.;3245,12;10244302;5,00
BURBUJERO POWER;1434,87;10244319;11,06
TERMOMETRO PARA HORNO AX5004;7663,60;10244333;1,00
PASTA SABOR FRUTOS DEL BOSQUE TOP CLASS x250grs x1 0004;15902,20;10244397;0,00
RELLENO AGUILA NUT X 290 GR;7837,53;10244442;4,00
SET PLACA PARA TOPPERS DIA DEL PADRE PARPEN x2 SPTP;8155,58;10244448;1,00
CAJA MULTIUSO CON VISOR IMPRESA DIA DEL PADRE 17x17x10cm;1490,52;10244449;0,00
CAPSULA PARA BOMBON x 10 gr;972,48;10244450;9,01
MOLDE TORTERA ALUMINIO INDIVIDUAL ALT.4 cm. Nº14 COOPER x1;8532,31;10244496;1,00
MOLDE TORTERA ALUMINIO INDIVIDUAL ALT.4 cm. Nº16  COOPER x1;10017,88;10244497;1,00
MOLDE TORTERA ALUMINIO INDIVIDUAL ALT.4 cm. Nº18  COOPER x1;10681,71;10244498;0,00
MOLDE TORTERA ALUMINIO INDIVIDUAL ALT.4 cm. Nº20  COOPER x1;11357,58;10244499;0,00
MOLDE TORTERA ALUMINIO INDIVIDUAL ALT.4 cm. Nº22  COOPER x1;12565,33;10244500;0,00
MOLDE TORTERA ALUMINIO INDIVIDUAL ALT.4 cm. Nº24  COOPER x1;13257,18;10244501;0,00
MOLDE TORTERA ALUMINIO INDIVIDUAL ALT.4 cm. Nº26  COOPER x1;14237,71;10244502;0,00
MOLDE TORTERA ALUMINIO INDIVIDUAL DESFONDABLE ALT.4 cm. Nº16 COOPER x1;14025,02;10244504;10,00
MOLDE TORTERA ALUMINIO INDIVIDUAL DESFONDABLE ALT.4 cm. Nº18 COOPER x1;14956,80;10244505;6,00
MOLDE TORTERA ALUMINIO INDIVIDUAL DESFONDABLE ALT.4 cm. Nº22 COOPER x1;17596,28;10244507;0,00
MOLDE TORTERA ALUMINIO INDIVIDUAL DESFONDABLE ALT.4 cm. Nº24 COOPER x1;18560,04;10244508;3,00
CORTANTES GEOMETRICOS CIRCULOS x2 Boti046B;5952,98;10244521;3,00
CORTANTES GEOMETRICOS CUADRADOS x2 Boti047B;6133,38;10244522;4,00
BANDERIN FELIZ CUMPLE SONIC x1 GM 804-2;2195,19;10244576;0,00
VASO TRAGO LARGO FLEXIBLE  PP x 10;4082,03;10244673;26,00
COPITA PETIT POSTRE DEGUSTACION CRISTAL 70cc x 12;3246,24;10244675;-7,78
TUTU MULTICOLOR FLUO CON CINTAS;8817,96;10244683;-2,00
TUTU MULTICOLOR FLUO CON CINTAS ADULTO ADOLESCENTE;9678,16;10244688;1,00
COLORANTE EN POLVO FLEIBOR COBALTO x4 (COMESTIBLE);3540,15;10244756;0,00
BANDERIN FELIZ CUMPLEANOS STAMPING KRAFT GM;2921,92;10244768;0,00
CREMA CHANTILLY ULTRA RICH X 1 LITRO;13863,70;10244770;2,00
BAÑO AGUILA SACHET CHOCOLATE CON LECHE SIN TACC x12 3331;48677,54;10244776;1,17
BAÑO AGUILA SACHET CHOCOLATE MARRON SIN TACC x12 3332;48677,54;10244777;0,92
BAÑO AGUILA SACHET CHOCOLATE BLANCO SIN TACC x12 3333;48677,54;10244778;1,59
RELLENO AGUILA 3 EN 1 X 290 GR;7576,28;10244779;4,00
PLATO CARTON KRAFT x10 GM 3346-24;3122,60;10244783;0,00
BANDEJA CARTON REDONDA DORADA Nº1 (16cm) x10u.;1561,72;10244787;0,00
BANDEJA CARTON REDONDA DORADA Nº3 (25cm) x10u.;0,00;10244789;0,00
BANDEJA CARTON REDONDA DORADA Nº4 (30cm) x10u.;6708,55;10244790;0,20
BANDEJA CARTON REDONDA DORADA Nº5 (33cm) x10u.;7008,16;10244791;6,00
BANDEJA CARTON RECTANGULAR DORADA Nº1 (13X18cm) x10u.;1552,99;10244797;8,00
BANDEJA CARTON RECTANGULAR DORADA Nº3 (18X26cm) x10u.;3742,55;10244801;-0,70
BANDEJA CARTON RECTANGULAR DORADA Nº5 (28x30cm) x10u.;6215,54;10244805;10,00
BANDEJA CARTON RECTANGULAR PLATEADA Nº2 (15X20cm) x10u.;1766,23;10244811;3,60
BANDEJA CARTON RECTANGULAR PLATEADA Nº3 (18X26cm) x10u.;3069,35;10244812;8,50
BANDEJA CARTON RECTANGULAR PLATEADA Nº4 (23X28cm) x10u.;3847,38;10244813;7,00
BANDEJA CARTON RECTANGULAR PLATEADA Nº5 (28x30cm) x10u.;5117,32;10244814;5,60
DISCO CARTON DORADO 16cm x25u.;4059,04;10244816;0,00
DISCO CARTON DORADO 18cm x25u.;4544,27;10244817;3,56
DISCO CARTON DORADO 22cm x25u.;7116,88;10244819;3,52
DISCO CARTON SOL DORADO 26 cm x10;5210,04;10244825;1,00
DISCO CARTON SOL DORADO 30cm x10;6086,70;10244826;4,80
DISCO CARTON SOL DORADO 34cm x10;10754,79;10244827;-0,70
DISCO CARTON SOL PLATEADO 26cm x10;4287,85;10244829;9,80
DISCO CARTON SOL PLATEADO 30cm x10;5265,23;10244830;9,30
DISCO CARTON SOL PLATEADO 34cm x10;9508,43;10244831;2,70
MANTECOL 253grs x1;6707,64;10244849;0,00
RELLENO COFLER BLOCK X 290 GRS;7315,03;10244850;2,00
SET PLACA PARA TOPPERS DIA DEL AMIGO PARPEN x2 SPTA;7571,85;10244866;3,00
BOWL CUADRADO CELESTE PASTEL KV x10 2115CPB;13267,71;10244883;5,00
BOWL CUADRADO ROSA PASTEL KV x10 2115RSPC;13267,71;10244884;0,00
SET PELUCHE VACA ( COLA - VINCHA - MOÑO ) x1 MM55-01A;3972,45;10244898;30,00
AZUCAR IMPALPABLE CORAL SIN TACC x250grs.;2208,49;10244942;10,00
AGAR AGAR ALZOL x 50 gr;4612,64;10245005;12,00
DISCO DE CARTON CUADRADO DORADO (12x12);253,44;10245006;250,00
MARCADOR COMESTIBLE MULTICOLOR;3765,66;10245007;10,01
VINCHA FRIDA 4 FLORES MULTICOLOR;7095,83;10245031;9,00
CORTANTE MARCADOR PLASTICO DINOSAURIOS x1 DESIGN;2029,27;10245144;8,00
CORTANTE MARCADOR PLASTICO PELOTA x1 DESIGN;2029,27;10245146;7,00
CORTANTE MARCADOR PLASTICO GORRO EGRESADOS x1 DESIGN;2029,27;10245148;8,00
CORTANTE MARCADOR PLASTICO MICKEY CONTORNO x1 DESIGN;1766,94;10245150;12,00
CORTANTE MARCADOR PLASTICO MINNIE CONTORNO  x1 DESIGN;1874,03;10245151;16,00
PLACA TRANSPARENTE CHOCOLINAS  COOPER;943,80;10245153;8,00
PLACA PARA CHUPETIN ECONOMICA DINOSAURIOS C314;842,41;10245155;4,80
PLACA PARA BOMBON/SOUVENIR 5 MEDIAS ESFERAS DIAMANTES 2651;943,35;10245158;7,00
ADORNO PINCHE POLIFAN VINILO FELIZ DIA AMOR ;1053,81;10245163;3,00
ADORNO PINCHE POLIFAN VINILO FELIZ CUMPLE MICKEY;1388,90;10245165;0,00
PICO PARPEN CONFITERO GRANDE ESTRELLA ABIERTA 3B;2912,83;10245167;6,00
CEREAL CROCANTE DE CHOCOLATE CON LECHE ARGENFRUT 50 gr;2203,26;10245168;7,01
CARAMELO PALITO DE LA SELVA x660grs. (CAJAx12);145368,58;10245185;1,16
CARAMELO PALITO DE LA SELVA  x660grs.;12979,34;10245193;13,92
PASTA DE GOMA COLOR NEGRA BALLINA X 500 GR;6736,48;10245199;4,00
BANDEJA GIRATORIA PLASTICA GIRAPARPEN CON BASE ANTIDESLIZANTE 30cm;39297,34;10245201;2,00
PIROTIN CUPCAKE Nº10 LISO CELESTE (M-PACK) ;797,31;10245217;0,00
COLORANTE LIQUIDO FLEIBOR ROSA;1783,78;10245219;0,00
COLORANTE LIQUIDO FLEIBOR CELESTE;1927,28;10245220;12,00
BICARBONATO DE SODIO ALZOL x100 GR;568,10;10245224;47,00
SACHET AGUILA BLANCO SIN TACC X 150 GR;5192,27;10245225;19,05
BAÑO AGUILA SACHET ROSA SABOR FRUTILLA;5254,08;10245227;3,04
SACHET AGUILA LECHE SIN TACC X 150 GR;5192,27;10245228;14,01
DISCO CARTON SOL PLATEADO 30 cm;526,52;10245235;93,00
DISCO CARTON SOL PLATEADO 34 cm;950,84;10245236;27,00
VARIEGATO MARACUYA TOP CLASS  x250grs;12922,58;10245272;0,00
GLOBO GLOBOX PERLADO 12 PULGADAS CHAMPAGNE X 50;10179,46;10245376;15,08
ILUMINADOR EN POLVO FLEIBOR NACAR;2461,62;10245385;0,00
ILUMINADOR EN POLVO FLEIBOR DORADO;2735,13;10245389;4,00
VASO 180cc NEGRO x10;823,68;10245396;88,00
VASO 180cc FUCSIA x 10;1087,26;10245397;1,00
VASO 180cc CELESTE x10;927,57;10245398;3,00
VASO 180cc AZUL x10;927,57;10245399;76,00
VASO BELLA CUP 220cc x10;667,07;10245400;213,00
VASO BELLA CUP 180cc x 10;719,00;10245401;244,00
VASO BELLA CUP CAFE 110cc  x10;567,10;10245402;237,00
CARETA PLASTICA ARACNIDO;1363,19;10245404;6,02
GLOBO METALIZADO 80cm ARCOIRIS;4631,21;10245406;5,00
PLATO COMUNION CALIZ CON ESPIGA x10 GM 9158;2929,09;10245446;4,00
AFICHE COMUNION CALIZ CON ESPIGA x1 GM 9155;2228,51;10245448;0,00
ESTAMPA COMUNION CALIZ CON ESPIGA x10 u.GM 9152;934,27;10245452;-2,00
PLACA PARA BOMBON BLOQUES LEGO;533,81;10245469;-3,00
CARETA PLASTICA PANTERA;1228,68;10245470;12,00
MANTEL COMUNION CALIZ CON ESPIGA x1 GM 9157;3812,83;10245521;1,00
CAJITA PARA BOMBONES 250GR ROJA;1270,50;10245523;2,00
CORNETA TRIPLE SONIDO;1649,57;10245524;47,00
DIENTE DRACULA BLANCO STASIO;293,81;10245568;189,01
CAJITA PARA BOMBONES 250GR NEGRA ;1210,00;10245572;-12,00
GUIRNALDA ECONOMICA MULTICOLOR x 2;1604,78;10245578;25,01
ESENCIA FLEIBOR TUTTI FRUTTI;1871,58;10245580;1,00
CAPELINA FLUO CON FLOR JERSEY ROX;4388,74;10245583;0,00
GLOBO GLOBOX 5" LISO CRISTAL x50 56247;5318,42;10245602;0,00
BOLSITA POLIPROPILENO 30x40cm (1 kg) x10U;1538,16;10245605;-13,00
PIÑATA GLOBO SUPER ESTRELLAS MULTICOLOR;2402,58;10245606;1,00
VINCHA PLASTICA MIEMBRO ;1822,40;10245607;117,00
CARETA PLASTICA HOMBRE MURCIELAGO;1363,19;10245614;14,01
AFICHE FELICIDADES SUPER HERO AVENGERS C.O. x1;2289,27;10245626;1,00
MANTEL SUPER HERO AVENGERS (1.20x1.80) x1 C.O;0,00;10245636;0,00
SERVILLETERO SUPER HERO AVENGERS x1 (15 serv.) C.O;1564,35;10245639;2,00
CAJITA PARA BOMBONES 250GR DORADA;1210,00;10245642;-5,00
MANTEL FISELINA LISO AMARILLO ECO & DECO;4655,24;10245759;16,00
MANTEL FISELINA LISO RECTANGULAR AZUL (1,20x1,80mtr);5379,84;10245760;0,00
MANTEL FISELINA LISO ROJO 200 CM X 140 CM;4866,85;10245764;14,00
PIÑATA GLOBO SUPER RAYADA AZUL;2402,58;10245768;0,00
COLORANTE EN POLVO FLEIBOR TURQUESA BRILLANTE;3822,53;10245771;0,00
CAJA DELIVERY GRANDE KRAFT MICROCORRUGADO 25x17x9 ;699,44;10245772;97,00
CHUPETIN MASTICABLE BABY DOLL x40 U;5285,19;10245801;15,50
VARIEGATO FRUTOS DEL BOSQUE TOP CLASS  x250grs;12491,83;10245802;0,00
ACIDO CITRICO ALZOL  100 GR;844,54;10245805;59,00
GORRO BRUJA COLOR JERSEY x1  art.1001;9873,60;10245808;13,00
GALERA CUADRADA MULTICOLOR FLUO JERSEY x1  art.1019;8470,00;10245815;3,00
GALERA VERTICAL BAJA MULTICOLOR FLUO JERSEY x1  art.1023;7199,50;10245822;0,00
MASCARA LATEX CON ELASTICO GATUBELA;15155,61;10245825;1,00
PAPEL PICADO METAL x3kg;9636,05;10245832;1,48
PORRA PLASTICA FLUO;712,19;10245868;2262,00
VINCHA FLUO FLOR DOBLE ;1726,97;10245870;6,00
CHUPETIN MASTICABLE BABY DOLL X 5;699,51;10245945;124,00
PLACA PARA BARRITAS DE CHOCOLATE KIT KAT G406;928,67;10245947;-2,00
ADORNO SET FELIZ CUMPLE 3D PRINCESAS x1 UPALALA;2744,28;10245951;0,00
DISCO CARTON SOL DORADO 26 cm;521,00;10245975;10,00
DISCO CARTON SOL DORADO 20 cm;372,25;10245976;100,00
DISCO CARTON SOL PLATEADO 20 cm;296,03;10245977;190,00
DISCO CARTON SOL PLATEADO 26 cm;428,79;10245978;98,00
SACHET AGUILA SEMIAMARGO SIN TACC X 150 GR;5192,27;10245979;11,02
PLACA PARA CHUPETIN HELADITOS DIAMANTES C327;1040,58;10245980;3,00
MOLDE BUDIN CON FLEJES 1/2kg x100uni.;25491,49;10245992;-2,00
VASO POLIPAPEL CORAZON CELESTE CON LUNARES 240cc ROMI PACK x8;2806,84;10246018;7,00
ADORNO COMUNION BASE PAPEL CREPE CALIZ CON ROSAS x1u. MARCELLINI;1675,37;10246057;-7,00
ADORNO COMUNION BASE PAPEL CREPE CALIZ CON ESPIGAS x1u. MARCELLINI;1270,50;10246060;-5,00
ESPATULA METAL PLANA 25 cm x1 BNB 20103;5411,57;10246099;3,00
PICOS PARA REPOSTERIA X 23 CON CUPLA BNB 20112;8899,97;10246100;4,00
ALPINO CON LECHE 250 GRS;4256,07;10246107;42,14
ALPINO BLANCO 250 GRS;4256,07;10246109;45,16
ALPINO SEMIAMARGO 250 GRS;4256,07;10246111;43,19
BANDERIN NARUTO x1 C.O;2445,12;10246215;2,00
GOMA TRAGACANTO XANTICA ALZOL 50 GRAMOS;1184,07;10246239;1,00
VASO 180cc VIOLETA x100;8698,10;10246245;0,00
NARIZ PAYASO DE GOMA ESPUMA ROJA x 10 1921;9310,95;10246299;6,50
MAQUILLAJE COLOR BLANCO;1002,70;10246336;110,00
MAQUILLAJE COLOR AZUL;954,72;10246337;2,03
MAQUILLAJE COLOR ROJO;1002,70;10246338;32,08
MAQUILLAJE COLOR CELESTE;1002,70;10246340;112,04
MAQUILLAJE COLOR FUCSIA;1002,70;10246341;-4,99
MAQUILLAJE COLOR LILA;1002,70;10246342;37,01
MAQUILLAJE COLOR MARRON;1002,70;10246343;6,01
MAQUILLAJE COLOR NARANJA;1002,70;10246344;62,02
MAQUILLAJE COLOR ROSA;1002,70;10246346;22,02
MAQUILLAJE COLOR VERDE CLARO;1002,70;10246347;-34,99
MAQUILLAJE COLOR VIOLETA;1002,70;10246348;-13,98
GUIRNALDA HALLOWEEN REDONDA BICOLOR;923,23;10246411;75,00
GUIRNALDA HALLOWEEN CALABAZA GRANDE NARANJA;2947,56;10246413;14,00
GUIRNALDA HALLOWEEN FANTASMA GRANDE;2853,83;10246414;33,00
GLOBO METALIZADO HALLOWEEN CALABAZA Y FANTASMA 36 CM;813,95;10246415;52,00
GLOBO METALIZADO CALABAZA CON ARANA 36cm;784,88;10246416;8,00
CALABAZA MINI NARANJA;1475,11;10246418;0,00
CUCHILLA HALLOWEEN;2012,47;10246420;103,01
VINCHA PLASTICA CUCHILLO SANGRIENTO;1413,75;10246421;3,01
CARETA PLASTICA BRUJA;1269,33;10246422;2,00
CARETA PLASTICA MONJA;1551,40;10246425;8,01
CARETA PLASTICA ZOMBIE REAL;1551,40;10246426;26,01
CARETA PLASTICA PURGA KISS ME;1762,95;10246427;5,01
GORRO BRUJA PLASTICO NEGRO;1635,41;10246428;43,01
CARETA PLASTICA CALAVERA;1466,64;10246429;30,01
CARETA PLASTICA MARTES 13;1448,43;10246430;9,00
CARETA PLASTICA SCREAM;1642,63;10246431;-5,98
CARETA PLASTICA CHUCKY;1548,07;10246432;28,01
VINCHA PLASTICA MALEFICA;1749,85;10246435;18,01
DISFRAZ ADULTO NOVIA CON TOCADO CANDELA T1x1 N109;44256,74;10246450;1,00
BOMBON FERRERO ROCHER 3 UNIDADES;4615,08;10246454;2,00
NARIZ PAYASO DE GOMA ESPUMA ROJA;993,17;10246455;65,00
MOLDE POLICARBONATO PARA BOMBON  ;10367,68;10246463;2,00
CALABAZA CON PAYASO ANIMADO Y LUZ 18006EVM;40645,45;10246481;1,00
BANDERIN HALLOWEEN OTERO;1787,45;10246488;0,00
PLATO HEXAGONAL CHICO HALLOWEEN x8u. C.O;1186,12;10246490;0,00
GLOBO METALIZADO ESQUELETO 36cm;784,88;10246494;92,00
GLOBO METALIZADO HALLOWEEN BRUJA 36cm;757,52;10246495;14,00
CARETA PLASTICA CLOWN TERROR;1551,40;10246498;1,00
CARTEL PUERTA CALAVERAS HALLOWEEN TERGOLINA;3642,78;10246510;2,00
PASTA SABOR PISTACHO TOP CLASS x250grs x1 0012;16470,14;10246579;0,00
CHOCOLATE MOLDATTE BLANCO (BULTO 6xkg) 050-90463;66619,43;10246609;-0,37
BANDERIN IMPORTADO FELIZ CUMPLEAÑOS CON BRILLO BLANCO  x1 72089;2553,62;10246612;0,00
CORTINA CUADRADITOS PLATA  HOLOGRAFICA ( 2.00 x1.00 mts ) x1 72478;2972,61;10246617;0,00
CORTINA CUADRADITOS ESTRELLAS MULTICOLOR ( 2.00 x1.00 mts ) x1 72492;2972,61;10246619;12,00
FAROL NARANJA CON LUZ HALLOWEEN x1 NW3;1863,91;10246625;0,00
CUCHILLA CARNICERO CON HUESO  x1 NW5;4624,79;10246627;2,00
HACHA SANGRIENTA CON HUESO  x1 NW6;4624,79;10246628;2,00
CARTEL PUERTA CALACA MUJER TERGOLINA x1 NW9;4451,72;10246631;6,00
CARETA RIGIDA OJOS SALTONES x1 NW14;5226,84;10246635;0,00
CARETA RIGIDA PANDEMIA NEGRA  x1 NW16;8552,92;10246637;1,00
CARETA RIGIDA PANDEMIA VERDE  x1 NW17;8552,92;10246638;3,00
ESQUELETO CALACA ARTICULADO  x1 NW18;8688,71;10246639;0,00
CADENA DE PRESO  x1 NW20;3584,00;10246641;8,00
CHOCOLITO MAPSA MARRON BULTO 6x500grs;34952,30;10246656;3,50
BOMBITA DE AGUA BOMBUCHA(CAJAx24x100);58442,46;10246658;2,77
